[
  {
    "meta": {
      "강좌명": "데이터베이스 정영희 동영상강의 계획서 없음",
      "담당교수": "데이터베이스 정영희 동영상강의 계획서 없음",
      "년도": "2025학년도",
      "학기": "2학기",
      "과목코드": "2025",
      "수강대상학과": "3학년 컴퓨터,빅데이터컴퓨 이수구분",
      "필수 선수과목": "권장 선수과목 Data Structure, Algorithm, File Processing, OS",
      "권장 선수과목": "Data Structure, Algorithm, File Processing, OS"
    },
    "chunk": "이 강의는 '데이터베이스 정영희 동영상강의 계획서 없음' 과목입니다. 담당 교수는 데이터베이스 정영희 동영상강의 계획서 없음입니다.개설 정보: 2025학년도 2학기\n1. 과목개요 강좌명 담당교수 데이터베이스 정영희 동영상강의 계획서 없음 (Course Title) (Instructor) 년도 학기 과목코드 2025학년도 2학기 2150132404 (Year) (Semester) (Course No.) 분반 수강대상학과 3학년 컴퓨터,빅데이터컴퓨 이수구분 04 전선-컴퓨터 (Class) (Open to) 팅융합,ICT유통물류융합 (Course Classification) 학점/주당시간 3.0 (0 ) / 3 성적스케일 점수 100기준 입력 성적평가방식 상대평가 교과목유형 이론 강의언어 상담 신청 방법 교수실 연락처 01090163392 이메일 (e-mail) icecoolof@gmail.com (Office) (Telephone) 강좌형식 이론 수업유형 동영상 제작년도 공학인증 교과목 교과영역(*) 인증구분(*) 관련 항목 (ABEEK Classification) (ABEEK Requirement) 필수 선수과목 권장 선수과목 Data Structure, Algorithm, File Processing, OS 데이터베이스 시스템에 대한 기본적인 지식을 습득한다. 데이터베이스의 기본 개념, 데이터 모델의 목적 및 종류, ER 이스 모델 등을 공부한다. 데이터베이스 언어인 SQL를 학습 (Course 하며, 상용 데이터베이스 시스템을 이용하여 실습을 병행한다. 또한 데이터베이스 설계의 중요한 단계인 정규화 이론 Description) 에 관하여 학습한다. 교육목표 전공특화역량 데이터베이스의 이론적 지식을 습득한다. 문제 정의 역량 데이터베이스의 실용적 지식을 습득한다. 문제 정의 역량 문제 정의 역량 데이터베이스의 설계 방식을 학습한다. 설계 역량 평가항목 각 항목별 만점(최대 100점) 반영비율(합계 100%) 중간고사 35 100 기말고사 35 100 과제 20 100 출석 10 100 주요교재 *미  Concepts/A. Silberschats, H. Korth, S./McGraw Hill 참고교재(대표) (Required Texts) 학습준비사항 수강학생 유의 및 참고사항 2. 주차별 강의개요 주 핵심어 세부내용 ption) (Te\n1주차 내용 요약: 과목개요 강좌명 담당교수 데이터베이스 정영희 동영상강의 계획서 없음 (Course Title) (Instructor) 년도 학기 과목코드 2025학년도 2학기 2150132404 (Year) (Semester) (Course No.) 분반 수강대상학과 3학년 컴퓨터,빅데이터컴퓨 이수구분\n2주차 내용 요약: 주차별 강의개요 주 (Week) ( ) ( ) ( ) 데이터베이스의 이해와 MySQL DBMS의 개요, MySQL의 개요, MySQL\n3주차 내용 요약: 설계교육계획서(공학인증) 교과목명 담당교수 학점(설계학점) 설계주제 문제정의 개념설계 설계 구성요소 설계구현 평가/피드백 경제성/생산성 사회윤리 현실적 제한조건 심미성/사용성 안전/환경 Open-ended problem 설계 Teamwork 운영요소 Communication skills\n4주차 내용 요약: 전선-컴퓨터 (Class) (Open to) 팅융합,ICT유통물류융합 (Course Classification) 학점/주당시간 3.0 (0 ) / 3 성적스케일 점수 100기준 입력 성적평가방식 상대평가 교과목유형 이론 강의언어 상담 신청 방법 교수실 연락처 01090163392 이메일 (e-mail) icecoolof@gmail.com (Office) (Telephone) 강좌형식 이론 수업유형 동영상 제작년도 공학인증 교과목 교과영역(*) 인증구분(*) 관련 항목 (ABEEK Classification) (ABEEK Requirement) 필수 선수과목 권장 선수과목 Data Structure, Algorithm, File Processing, OS 데이터베이스 시스템에 대한 기본적인 지식을 습득한다....\n5주차 내용 요약: 데이터 검색 강의, 실험,실습,실기 MySQL 실습 WHERE 문, GROUP BY … HAVING 문\n6주차 내용 요약: 데이터 삽입, 수정, 삭제 데이터 삽입, 수정, 삭제 강의, 실험,실습,실기 MySQL 실습 데이터 형식의 종류, 변수와 형 변환, 내\n7주차 내용 요약: 데이터 형식과 내장 함수 강의, 실험,실습,실기 MySQL 실습 장 함수\n8주차 내용 요약: 중간고사 1-7주차 내용으로 중간고사 진행 강의\n9주차 내용 요약: 조인과 SQL 프로그래밍 조인과 SQL 프로그래밍 강의, 실험,실습,실기 MySQL 실습 테이블 생성, 제약 조건, 테이블 압축과\n10주차 내용 요약: 테이블과 뷰 강의, 실험,실습,실기 MySQL 실습 임시 테이블, 테이블 삭제와 수정, 뷰 개념적 설계 개요, 개념적 스키마 모델링 순서, 개체/관계/속성 식별, ER 다이어그\n11주차 내용 요약: 개념적 설계 강의 램 작성, 개념적 스키마 모델링 사례, 트 랜잭션 모델링, 개념적 설계 사례 관계 데이터 모델 개요, 릴레이션의 개념\n12주차 내용 요약: 관계 데이터 모델 과 특성, 관계 데이터베이스, 데이터베이 강의 스 키, 무결성 제약조건 논리적 설계 개요, 릴레이션 스키마 변환, 개체 타입의 변환, 관계 타입의 변환, 다\n13주차 내용 요약: 논리적 설계 중치 속성의 변환, 슈퍼-서브 타입의 변 강의 환, 릴레이션 단순화, 릴레이션 스키마 변 환 사례 이상 현상, 함수적 종속과 함수적 종속 다 이어그램, 완전 함수적 종속과 부분 함수\n14주차 내용 요약: 정규화 강의 적 종속, 이행적 함수적 종속, 정규화, 제 1제2제3 정규형, 역정규화, 정규화 사례\n15주차 내용 요약: 기말고사 9-17주차 내용으로 기말고사 진행 강의 [ 장애학생을 위한 강의 지원 안내 내용 ] ※ 숭실대학교 학칙 제65조의 2에 의거하여, 장애학생은 학기 시작 전후에 교과목 담당교수와 의 면담을 통해 출석, 강의, 과제 및 평가에 관한 지원 사항을 요청할 수 있으며, 요청한 사 항은 담당교수 또는 장애학생지원센터를 통해 지원받을 수 있습니다. 강의, 과제 및 평가 시, 가능한 장애유형별 지원의 예는 아래와 같습니다. 단, 실제 지원 내용은 강의 특성에 따 라 달라질 수 있습니다. [ 강의 ] 시각장애: 강의자료 제공, 대필 도우미 허용, 강의녹취 허용 지체장애: 강의자료 제공, 대필 및 수업보조 도우미 허용, 지정좌석 배정, 강의녹취 허용 청각장애: 강의자료 제공, 대필/수화통역 도우미 허용 지적장애/자..."
  },
  {
    "meta": {
      "강좌명": "자연언어처리 김성신 동영상강의 계획서 없음",
      "담당교수": "자연언어처리 김성신 동영상강의 계획서 없음",
      "년도": "2025학년도",
      "학기": "2학기",
      "과목코드": "2025",
      "수강대상학과": "3학년 AI융합학부,AI모빌리 이수구분",
      "필수 선수과목": "권장 선수과목 딥러닝프로그래밍및실습",
      "권장 선수과목": "딥러닝프로그래밍및실습"
    },
    "chunk": "이 강의는 '자연언어처리 김성신 동영상강의 계획서 없음' 과목입니다. 담당 교수는 자연언어처리 김성신 동영상강의 계획서 없음입니다.개설 정보: 2025학년도 2학기\n1. 과목개요 강좌명 담당교수 자연언어처리 김성신 동영상강의 계획서 없음 (Course Title) (Instructor) 년도 학기 과목코드 2025학년도 2학기 2150076501 (Year) (Semester) (Course No.) 분반 수강대상학과 3학년 AI융합학부,AI모빌리 이수구분\n1주차 내용 요약: 전선-AI융합 (Class) (Open to) 티융합 (Course Classification) 학점/주당시간 3.0 / 03 / 3 성적스케일 점수 100기준 입력 성적평가방식 절대평가 교과목유형 이론 강의언어 상담 신청 방법 교수실 연락처 0956 이메일 (e-mail) kss0222@ssu.ac.kr (Office) (Telephone) 이론, 문제기반학습 강좌형식 수업유형 동영상 제작년도 (PBL) 공학인증 교과목 교과영역(*) 인증구분(*) 관련 항목 (ABEEK Classification) (ABEEK Requirement) 필수 선수과목 권장 선수과목 딥러닝프로그래밍및실습 교과목 개요 자연어 처리는 컴퓨터가 인간의 언어를 이해 및 생성하도록 하는 기술을 다루는 인공지능의 한 분야이다. 이 강의에...\n2주차 내용 요약: Deep learning basics 딥러닝 기초 이론 및 실습 MLP 구현 실습 의 Tokenization, 바이트페어인코딩, 강의, 실험,실습,실기 , 아이디 One-hot 인코딩 실\n3주차 내용 요약: 설계교육계획서(공학인증) 교과목명 담당교수 학점(설계학점) 설계주제 문제정의 개념설계 설계 구성요소 설계구현 평가/피드백 경제성/생산성 사회윤리 현실적 제한조건 심미성/사용성 안전/환경 Open-ended problem 설계 Teamwork 운영요소 Communication skills\n4주차 내용 요약: 언어모델 N-gram, 확률적 언어 모델 강의, 실험,실습,실기 N-gram 실습 Gensim, Embedding\n5주차 내용 요약: 워드 임베딩(1) One-hot 벡터, Count Vector, TF-IDF 강의, 실험,실습,실기 실습\n6주차 내용 요약: 워드 임베딩(2) Word2Vec, Glove 익히기 강의, 실험,실습,실기 Word2Vec 실습 RNN,LSTM 감성 분석 순환 신경망(RNN)을 이용한 언어 모델 강의, 실험,실습,실기 , 해결방\n7주차 내용 요약: RNN, LSTM 실습 및 텍스트 분류 안적용및 확인 캐글 리더보드 참가\n8주차 내용 요약: Midterm exam 중간 시험 (이론+실기) 실시 시험 Transformer 아키텍처 분석, 어텐션 메커 트랜스포머 실습, 논\n9주차 내용 요약: Transformer 강의, 실험,실습,실기 니즘 문 읽기&요약\n10주차 내용 요약: 사전학습 언어모델(1) BERT와 같은 사전 학습 모델의 활용 강의, 실험,실습,실기 BERT\n11주차 내용 요약: 사전학습 언어모델(2) GPT와 같은 사전 학습 모델의 활용 강의, 실험,실습,실기 GPT\n12주차 내용 요약: NLP 응용(1) 텍스트 분류에 대한 실습 및 분석 강의, 실험,실습,실기 텍스트 분류\n13주차 내용 요약: NLP 응용(2) 기계번역에 대한 실습 및 분석 강의, 실험,실습,실기 HuggingFace 실습 대규모 언어 모델(LLM) 최신 트\n14주차 내용 요약: LLM의 최신 동향 및 AI 윤리 강의, 실험,실습,실기 프로젝트 발표 준비 렌드 Engaged Learning+\n15주차 내용 요약: 기말 발표 최종 프로젝트 발표.. 시험 적용 [ 장애학생을 위한 강의 지원 안내 내용 ] ※ 숭실대학교 학칙 제65조의 2에 의거하여, 장애학생은 학기 시작 전후에 교과목 담당교수와 의 면담을 통해 출석, 강의, 과제 및 평가에 관한 지원 사항을 요청할 수 있으며, 요청한 사 항은 담당교수 또는 장애학생지원센터를 통해 지원받을 수 있습니다. 강의, 과제 및 평가 시, 가능한 장애유형별 지원의 예는 아래와 같습니다. 단, 실제 지원 내용은 강의 특성에 따 라 달라질 수 있습니다. [ 강의 ] 시각장애: 강의자료 제공, 대필 도우미 허용, 강의녹취 허용 지체장애: 강의자료 제공, 대필 및 수업보조 도우미 허용, 지정좌석 배정, 강의녹취 허용 청각장애: 강의자료 제공, 대필/수화통역 도우미 허용 지적장애/자폐성장..."
  },
  {
    "meta": {
      "강좌명": "인공지능입문 한영준 동영상강의 계획서 없음",
      "담당교수": "인공지능입문 한영준 동영상강의 계획서 없음",
      "년도": "2025학년도",
      "학기": "2학기",
      "과목코드": "2025",
      "수강대상학과": "이수구분",
      "필수 선수과목": "권장 선수과목",
      "권장 선수과목": "교과목 개요 인공지능은 컴퓨터를 통해 인간 지능을 구현한 컴퓨터 알고리즘이나 컴퓨터시스템이다. 본 과목에서는 인공지능의 핵"
    },
    "chunk": "이 강의는 '인공지능입문 한영준 동영상강의 계획서 없음' 과목입니다. 담당 교수는 인공지능입문 한영준 동영상강의 계획서 없음입니다.개설 정보: 2025학년도 2학기\n1. 과목개요 강좌명 담당교수 인공지능입문 한영준 동영상강의 계획서 없음 (Course Title) (Instructor) 년도 학기 과목코드 2025학년도 2학기 2150031003 (Year) (Semester) (Course No.) 분반 수강대상학과 이수구분 03 1학년 AI융합학부,AI로봇융합,AI모빌리티융 전선-AI융합 (Class) (Open to) 합,스마트자동차융합,인공지능 (Course Classification) 학점/주당시간 3.0 / 03 / 3 성적스케일 점수 100기준 입력 성적평가방식 상대평가 교과목유형 이론 강의언어 상담 신청 방법 교수실 연락처 벤처관708호 02-820-0953 이메일 (e-mail) young@ssu.ac.kr (Office) (Telephone) 강좌형식 이론, 토론식수업 수업유형 동영상 제작년도 공학인증 교과목 교과영역(*) 인증구분(*) 관련 항목 (ABEEK Classification) (ABEEK Requirement) 필수 선수과목 권장 선수과목 알고리즘이나 컴퓨터시스템이다. 본 과목에서는 인공지능의 핵 (Course 심 요소기술인 탐색, 지식의 표현 및 추론, 계획수립 등을 학습하고 응용분야인 전문가 시스템, 기계학습, 데이터 마이닝 Description) 등을 포함한 인공지능 이론을 학습한다. 교육목표 전공특화역량 인공지능의 기본 개념과 원리를 이해한다. AI/빅데이터 역량 지능적 에이전트의 구조와 작동 방식을 학습한다. AI/빅데이터 역량 인공지능에서 탐색, 논리, 지식표현, 계획 등 핵심 문제의 해결 방법을 학습한다. AI/빅데이터 역량 응용 소프트웨어 역량 AI/빅데이터 역량 Wumpus World의 팀프로젝트를 통해 AI 사고방식을 학습한다. 응용 소프트웨어 역량 평가항목 각 항목별 만점(최대 100점) 반영비율(합계 100%) 중간고사 100 30 기말고사 100 30 과제 100 30 출석 10 10 *lligence: A Modern Approach)/스트어트 러 주요교재 1/4/원서도 가능함/지정도서 및 재/인공지능/이건명/생능출판/2019/1/지정도서 학습준비사항 수강학생 유의 및 참고사항\n1주차 내용 요약: 과목개요 강좌명 담당교수 인공지능입문 한영준 동영상강의 계획서 없음 (Course Title) (Instructor) 년도 학기 과목코드 2025학년도 2학기 2150031003 (Year) (Semester) (Course No.) 분반 수강대상학과 이수구분\n2주차 내용 요약: 주차별 강의개요 주 (Week) ( ) ( ) ( ) - AI 정의와 역사\n3주차 내용 요약: 1학년 AI융합학부,AI로봇융합,AI모빌리티융 전선-AI융합 (Class) (Open to) 합,스마트자동차융합,인공지능 (Course Classification) 학점/주당시간 3.0 / 03 / 3 성적스케일 점수 100기준 입력 성적평가방식 상대평가 교과목유형 이론 강의언어 상담 신청 방법 교수실 연락처 벤처관708호 02-820-0953 이메일 (e-mail) young@ssu.ac.kr (Office) (Telephone) 강좌형식 이론, 토론식수업 수업유형 동영상 제작년도 공학인증 교과목 교과영역(*) 인증구분(*) 관련 항목 (ABEEK Classification) (ABEEK Requirement) 필수 선수과목 권장 선수과목 교과목 개요 인공지능은 컴퓨터를 통해 인간 지능을 구현한 컴퓨터 알...\n4주차 내용 요약: 탐색 문제 해결 II - 평가 함수 개념 강의, 토론 3장 - 탐색 알고리즘 비교 - 실세계 문제 탐색(로봇, 경로계획)\n5주차 내용 요약: 복잡한 환경에서의 탐색 - 반복 심화 탐색 강의, 토론 4장 - 성능 평가 - 변수, 도메인, 제약 개념\n6주차 내용 요약: 제약 만족 문제(CSP) - 백트래킹, 제약 전파 소개 강의, 토론 5장 - 간단한 퍼즐 예제 - 미니맥스 알고리즘\n7주차 내용 요약: 적대적 탐색과 게임 - 알파-베타 가지치기 강의, 토론 6장 - 틱택토 사례 분석\n8주차 내용 요약: 중간고사 이론 중간고사를 치름 시험 시험 -지식기반 에이전트\n9주차 내용 요약: 논리적 추론 기초1 -웜퍼스 세게 강의, 토론 7장 - 논리 - 명제논리\n10주차 내용 요약: 논리적 추론 기초2 - 명제 정리 증명 강의, 토론 7장 - 명제 논리에 기초한 에이전트 - 표현의 재고차 - 1차 논리의 구문과 의미론\n11주차 내용 요약: 1차 논리 강의, 토론 8장 - 1차 논리 활용 - 1차 논리의 지식 공학 - 명제 추론 대 1차 추론 - 단일화의 1차 추론\n12주차 내용 요약: 1차 논리의 추론 강의, 토론 9장 - 순방향 및 역방향 연쇄 -분해 - 온톨로지 공학 - 범주와 객체\n13주차 내용 요약: 지식 표현, 팀프로젝트 - 정신적 객체와 양상 논리 강의, 토론 10장 - 범주 추론 시스템 - 기본 정보를 이용한 추론 -고전적 계획 수립 정의 -고전적 계획 수립을 위한 알고리즘들\n14주차 내용 요약: 자동 계획 수립 강의, 토론 11장 - 계획수립을 위한 발견적 함수 -위계적 계획 수립\n15주차 내용 요약: 기말고사 팀프로젝트 발표, 이론 기말 고사 시험 시험 [ 장애학생을 위한 강의 지원 안내 내용 ] ※ 숭실대학교 학칙 제65조의 2에 의거하여, 장애학생은 학기 시작 전후에 교과목 담당교수와 의 면담을 통해 출석, 강의, 과제 및 평가에 관한 지원 사항을 요청할 수 있으며, 요청한 사 항은 담당교수 또는 장애학생지원센터를 통해 지원받을 수 있습니다. 강의, 과제 및 평가 시, 가능한 장애유형별 지원의 예는 아래와 같습니다. 단, 실제 지원 내용은 강의 특성에 따 라 달라질 수 있습니다. [ 강의 ] 시각장애: 강의자료 제공, 대필 도우미 허용, 강의녹취 허용 지체장애: 강의자료 제공, 대필 및 수업보조 도우미 허용, 지정좌석 배정, 강의녹취 허용 청각장애: 강의자료 제공, 대필/수화통역 도우미 허용 지적장애..."
  },
  {
    "meta": {
      "강좌명": "프로그래밍및실습2 김성신 동영상강의 계획서 없음",
      "담당교수": "프로그래밍및실습2 김성신 동영상강의 계획서 없음",
      "년도": "2025학년도",
      "학기": "2학기",
      "과목코드": "2025",
      "수강대상학과": "이수구분",
      "필수 선수과목": "권장 선수과목",
      "권장 선수과목": "교과목 개요"
    },
    "chunk": "이 강의는 '프로그래밍및실습2 김성신 동영상강의 계획서 없음' 과목입니다. 담당 교수는 프로그래밍및실습2 김성신 동영상강의 계획서 없음입니다.개설 정보: 2025학년도 2학기\n1. 과목개요 강좌명 담당교수 프로그래밍및실습2 김성신 동영상강의 계획서 없음 (Course Title) (Instructor) 년도 학기 과목코드 2025학년도 2학기 2150679802 (Year) (Semester) (Course No.) 분반 수강대상학과 이수구분 02 1학년 AI융합학부 전기-AI융합 (Class) (Open to) (Course Classification) 학점/주당시간 3.0 / 04 / 4 성적스케일 점수 100기준 입력 성적평가방식 절대평가 교과목유형 이론+실험.실습 강의언어 상담 신청 방법 이메일 교수실 연락처 전산관529호 02-820-0956 이메일 (e-mail) kss0222@ssu.ac.kr (Office) (Telephone) 이론, 문제기반학습 강좌형식 수업유형 동영상 제작년도 (PBL) 공학인증 교과목 교과영역(*) 인증구분(*) 관련 항목 (ABEEK Classification) (ABEEK Requirement) 필수 선수과목 권장 선수과목 문, 반복문, 함수 등)을 학습하며, 응용 프로그램 작성 실습을 통해서 (Course 프로그래밍의 기초와 문제 해결 능력을 습득한다. Description) 교육목표 전공특화역량 AI/빅데이터 역량 C언어의 기본 문법과 프로그래밍 기법을 익히고, 문제 해결 능력과 논리적 사고력을 향상시키며, 실습을 시스템 HW/SW 개발 역량 통해 소프트웨어 개발의 기초를 다진다. 자율주행 개발 역량 응용 소프트웨어 역량 평가항목 각 항목별 만점(최대 100점) 반영비율(합계 100%) 제안서 발표 100 10 과제 100 10 최종 발표 100 30 출석 100 10 퀴즈 100 15 중간결과물 100 10 중간고사 100 15 주요교재 *고자료 참고교재(대표) *부교재/Warming-Up C Programming/천정아/연두에디션 (Required Texts) 학습준비사항 장 강의 + 질의 응답 수강학생 유의 - 실습 과제 : 프로그램에 대한 간단한 설명(주석문)과 함께 프로그램이 실행된 캡처화면 워드 파일에 저장 및 참고사항 - 기말 과제 : 최종 보고서 기한은 14주차 이전까지 제출 2. 주차별 강의개요 주 핵심어 세부내용 \n1주차 내용 요약: 과목개요 강좌명 담당교수 프로그래밍및실습2 김성신 동영상강의 계획서 없음 (Course Title) (Instructor) 년도 학기 과목코드 2025학년도 2학기 2150679802 (Year) (Semester) (Course No.) 분반 수강대상학과 이수구분\n2주차 내용 요약: 1학년 AI융합학부 전기-AI융합 (Class) (Open to) (Course Classification) 학점/주당시간 3.0 / 04 / 4 성적스케일 점수 100기준 입력 성적평가방식 절대평가 교과목유형 이론+실험.실습 강의언어 상담 신청 방법 이메일 교수실 연락처 전산관529호 02-820-0956 이메일 (e-mail) kss0222@ssu.ac.kr (Office) (Telephone) 이론, 문제기반학습 강좌형식 수업유형 동영상 제작년도 (PBL) 공학인증 교과목 교과영역(*) 인증구분(*) 관련 항목 (ABEEK Classification) (ABEEK Requirement) 필수 선수과목 권장 선수과목 교과목 개요 C와 같은 고급 언어의 기본 문법(데이터 타입, 조건문, 반복문, 함수 등)...\n3주차 내용 요약: 설계교육계획서(공학인증) 교과목명 담당교수 학점(설계학점) 설계주제 문제정의 개념설계 설계 구성요소 설계구현 평가/피드백 경제성/생산성 사회윤리 현실적 제한조건 심미성/사용성 안전/환경 Open-ended problem 설계 Teamwork 운영요소 Communication skills\n4주차 내용 요약: 조건문 (6장) 을 실습한다. 어 도출 반복문에 대해 학습하고 관련 프로그래밍 (7장)\n5주차 내용 요약: 반복문 강의, 실험,실습,실기 을 실습한다. 함수에 대해 학습하고 관련 프로그래밍을 (8장)\n6주차 내용 요약: 함수 강의, 실험,실습,실기 실습한다. 함수와 변수에 대해 학습하고 관련 프로그 강의, 실험,실습,실기 , 해결방\n7주차 내용 요약: 함수와 변수 (9장) 래밍을 실습한다. 안적용및 확인\n8주차 내용 요약: 중간고사 중간고사를 시행하고 토의한다. 시험 배열에 대해 학습하고 관련 프로그래밍을 (10장)\n9주차 내용 요약: 배열 강의, 실험,실습,실기 실습한다. 포인터에 대해 학습하고 관련 프로그래밍\n10주차 내용 요약: 포인터 강의, 실험,실습,실기 (11장) 을 실습한다. 문자와 문자열에 대해 학습하고 관련 프로\n11주차 내용 요약: 문자와 문자열 강의, 실험,실습,실기 (12장) 그래밍을 실습한다. 구조체에 대해 학습하고 관련 프로그래밍\n12주차 내용 요약: 구조체 강의, 실험,실습,실기 (13장) 을 실습한다. 포인터활용에 대해 학습하고 관련 프로그\n13주차 내용 요약: 포인터활용 강의, 실험,실습,실기 (14장) 래밍을 실습한다. 스트림과 파일입출력 대해 학습하고 관련\n14주차 내용 요약: 스트림과 파일입출력 강의, 실험,실습,실기 (15장) 프로그래밍을 실습한다. C언어를 활용한 프로젝트를 진행하고 해 프로젝트 최종 보고서\n15주차 내용 요약: 기말과제 발표 발표, 시험 당 내용을 발표한다. 제출 및 발표 [ 장애학생을 위한 강의 지원 안내 내용 ] ※ 숭실대학교 학칙 제65조의 2에 의거하여, 장애학생은 학기 시작 전후에 교과목 담당교수와 의 면담을 통해 출석, 강의, 과제 및 평가에 관한 지원 사항을 요청할 수 있으며, 요청한 사 항은 담당교수 또는 장애학생지원센터를 통해 지원받을 수 있습니다. 강의, 과제 및 평가 시, 가능한 장애유형별 지원의 예는 아래와 같습니다. 단, 실제 지원 내용은 강의 특성에 따 라 달라질 수 있습니다. [ 강의 ] 시각장애: 강의자료 제공, 대필 도우미 허용, 강의녹취 허용 지체장애: 강의자료 제공, 대필 및 수업보조 도우미 허용, 지정좌석 배정, 강의녹취 허용 청각장애: 강의자료 제공, 대필/수화통역 도우미 허용..."
  },
  {
    "meta": {
      "강좌명": "프로그래밍및실습2 손장우 동영상강의 계획서 없음",
      "담당교수": "프로그래밍및실습2 손장우 동영상강의 계획서 없음",
      "년도": "2025학년도",
      "학기": "2학기",
      "과목코드": "2025",
      "수강대상학과": "이수구분",
      "필수 선수과목": "권장 선수과목",
      "권장 선수과목": "교과목 개요"
    },
    "chunk": "이 강의는 '프로그래밍및실습2 손장우 동영상강의 계획서 없음' 과목입니다. 담당 교수는 프로그래밍및실습2 손장우 동영상강의 계획서 없음입니다.개설 정보: 2025학년도 2학기\n1. 과목개요 강좌명 담당교수 프로그래밍및실습2 손장우 동영상강의 계획서 없음 (Course Title) (Instructor) 년도 학기 과목코드 2025학년도 2학기 2150679804 (Year) (Semester) (Course No.) 분반 수강대상학과 이수구분 04 1학년 AI융합학부 전기-AI융합 (Class) (Open to) (Course Classification) 학점/주당시간 3.0 / 04 / 4 성적스케일 점수 100기준 입력 성적평가방식 상대평가 교과목유형 이론+실험.실습 강의언어 상담 신청 방법 이메일 교수실 연락처 02-820-0959 02-820-0959 이메일 (e-mail) jwshon@ssu.ac.kr (Office) (Telephone) 이론, 문제기반학습 강좌형식 수업유형 동영상 제작년도 (PBL) 공학인증 교과목 교과영역(*) 인증구분(*) 관련 항목 (ABEEK Classification) (ABEEK Requirement) 필수 선수과목 권장 선수과목 문, 반복문, 함수 등)을 학습하며, 응용 프로그램 작성 실습을 통해서 (Course 프로그래밍의 기초와 문제 해결 능력을 습득한다. Description) 교육목표 전공특화역량 AI/빅데이터 역량 C 언어의 문법과 구조를 학습하여 저 수준 프로그래밍 학습 능력을 배양한다. 시스템 HW/SW 개발 역량 응용 소프트웨어 역량 AI/빅데이터 역량 시스템 HW/SW 개발 역량 논리적 사고와 프로그래밍 패턴을 익히고 기본 프로그래밍 능력을 키운다. 자율주행 개발 역량 응용 소프트웨어 역량 AI/빅데이터 역량 시스템 HW/SW 소프트웨어 기초 동작 원리를 이해하고 프로그래밍 능력을 키운다. 시스템 HW/SW 개발 역량 응용 소프트웨어 역량 평가항목 각 항목별 만점(최대 100점) 반영비율(합계 100%) 출석 100 10 과제 100 20 중간고사 100 35 기말고사 100 35 * Programming with C for DUMMIES/Dan Gookin/John Wiley & Sons, 및 I/2015/1th 인국/생능출판사/2023/1th (Required Texts) *참고교재/쉽게 풀어쓴 C언어 Express/천인국/생능출판사/2022\n1주차 내용 요약: 과목개요 강좌명 담당교수 프로그래밍및실습2 손장우 동영상강의 계획서 없음 (Course Title) (Instructor) 년도 학기 과목코드 2025학년도 2학기 2150679804 (Year) (Semester) (Course No.) 분반 수강대상학과 이수구분\n2주차 내용 요약: 820-0959 02-820-0959 이메일 (e-mail) jwshon@ssu.ac.kr (Office) (Telephone) 이론, 문제기반학습 강좌형식 수업유형 동영상 제작년도 (PBL) 공학인증 교과목 교과영역(*) 인증구분(*) 관련 항목 (ABEEK Classification) (ABEEK Requirement) 필수 선수과목 권장 선수과목 교과목 개요 C와 같은 고급 언어의 기본 문법(데이터 타입, 조건문, 반복문, 함수 등)을 학습하며, 응용 프로그램 작성 실습을 통해서 (Course 프로그래밍의 기초와 문제 해결 능력을 습득한다. ) 교육목표 전공특화역량 AI/빅데이터 역량 C 언어의 문법과 구조를 학습하여 저 수준 프로그래밍 학습 능력을 배양한다. 시스템 HW/SW 개발 역량 응용 소프트웨...\n3주차 내용 요약: 설계교육계획서(공학인증) 교과목명 담당교수 학점(설계학점) 설계주제 문제정의 개념설계 설계 구성요소 설계구현 평가/피드백 경제성/생산성 사회윤리 현실적 제한조건 심미성/사용성 안전/환경 Open-ended problem 설계 Teamwork 운영요소 Communication skills\n4주차 내용 요약: 1학년 AI융합학부 전기-AI융합 (Class) (Open to) (Course Classification) 학점/주당시간 3.0 / 04 / 4 성적스케일 점수 100기준 입력 성적평가방식 상대평가 교과목유형 이론+실험.실습 강의언어 상담 신청 방법 이메일 교수실 연락처\n5주차 내용 요약: 배열과 문자열 강의, 실험,실습,실기 문자열 함수 및 printf 문자열 형식 3 구조 체와 공용 체 차이, 배열 구조 체, 변 주 교재, 참고 교재 1 ~\n6주차 내용 요약: 구조체, 공용체 강의, 실험,실습,실기 수의 변환 및 C 객체 지향 프로그래밍 3 변수의 저장, 변수의 크기와 위치, 배열의 주 교재, 참고 교재 1 ~\n7주차 내용 요약: 포인터 주소, 배열에서 포인터 연산, 포인터 문자 강의, 실험,실습,실기 3 열 및 구조체 포인터 필기와 코딩 실기 평가 (필기 50%, 실기\n8주차 내용 요약: 중간 평가 시험 주 교재 1 ~ 7 주차 50%) 포인터 연산, 비교, 포인터 함수, void 포인 주 교재, 참고 교재 1 ~\n9주차 내용 요약: 동적 메모리와 포인터 함수 터, 포인터에서 메모리 할당, heap 과 stack 강의, 실험,실습,실기 3 그리고 함수 포인터 포인터를 복습하고 연결 리스트 데이터 동 주 교재, 참고 교재 1 ~\n10주차 내용 요약: Linked List 강의, 실험,실습,실기 작을 이해한다. 3 주 교재, 참고 교재 1 ~\n11주차 내용 요약: 전처리와 다중 파일 make, Makefile 및 cmake 사용해 보기 강의, 실험,실습,실기\n12주차 내용 요약: 파일 입출력 텍스트와 바이너리 파일 읽고 쓰기 강의, 실험,실습,실기 3 포인터를 복습하고 큐와 스택 데이터 동작 주 교재, 참고 교재 1 ~\n13주차 내용 요약: Queue and Stack 강의, 실험,실습,실기 을 이해한다. 3 포인터를 복습하고 이진 트리 알고리즘 동 주 교재, 참고 교재 1 ~\n14주차 내용 요약: Binary Tree 강의, 팀티칭, 실험,실습,실기 작을 이해한다. 3 필기와 코딩 실기 평가(필기 50%, 실기\n15주차 내용 요약: 기말 평가 시험 주 교재 9 ~ 14 주차 50%) [ 장애학생을 위한 강의 지원 안내 내용 ] ※ 숭실대학교 학칙 제65조의 2에 의거하여, 장애학생은 학기 시작 전후에 교과목 담당교수와 의 면담을 통해 출석, 강의, 과제 및 평가에 관한 지원 사항을 요청할 수 있으며, 요청한 사 항은 담당교수 또는 장애학생지원센터를 통해 지원받을 수 있습니다. 강의, 과제 및 평가 시, 가능한 장애유형별 지원의 예는 아래와 같습니다. 단, 실제 지원 내용은 강의 특성에 따 라 달라질 수 있습니다. [ 강의 ] 시각장애: 강의자료 제공, 대필 도우미 허용, 강의녹취 허용 지체장애: 강의자료 제공, 대필 및 수업보조 도우미 허용, 지정좌석 배정, 강의녹취 허용 청각장애: 강의자료 제공, 대필/수화통역 도우미 허용 지적장애/..."
  },
  {
    "meta": {
      "강좌명": "디지털시스템입문 신동화 동영상강의 계획서 없음",
      "담당교수": "디지털시스템입문 신동화 동영상강의 계획서 없음",
      "년도": "2025학년도",
      "학기": "2학기",
      "과목코드": "2025",
      "수강대상학과": "이수구분",
      "필수 선수과목": "권장 선수과목",
      "권장 선수과목": "교과목 개요"
    },
    "chunk": "이 강의는 '디지털시스템입문 신동화 동영상강의 계획서 없음' 과목입니다. 담당 교수는 디지털시스템입문 신동화 동영상강의 계획서 없음입니다.개설 정보: 2025학년도 2학기\n1. 과목개요 강좌명 담당교수 디지털시스템입문 신동화 동영상강의 계획서 없음 (Course Title) (Instructor) 년도 학기 과목코드 2025학년도 2학기 2150686901 (Year) (Semester) (Course No.) 분반 수강대상학과 이수구분\n1주차 내용 요약: 2학년 AI융합학부 전필-AI융합 (Class) (Open to) (Course Classification) 학점/주당시간 3.0 (0 ) / 3 성적스케일 점수 100기준 입력 성적평가방식 상대평가 교과목유형 이론 강의언어 상담 신청 방법 Office Hour 교수실 연락처 051301 02-820-0638 이메일 (e-mail) donghwashin@ssu.ac.kr (Office) (Telephone) 강좌형식 이론 수업유형 동영상 제작년도 공학인증 교과목 교과영역(*) 인증구분(*) 관련 항목 (ABEEK Classification) (ABEEK Requirement) 필수 선수과목 권장 선수과목 교과목 개요 기초적인 디지털 논리 게이트 및 논리 소자의 구성과 동작 원리, 조합 논리 회로 및 순차 논...\n2주차 내용 요약: 주차별 강의개요 주 (Week) ( ) ( ) ( ) 디지털 회로 설계 과정 이해 디지털 논리 게이트, 기본 디지털 논리 게이트 동작 이해\n3주차 내용 요약: 설계교육계획서(공학인증) 교과목명 담당교수 학점(설계학점) 설계주제 문제정의 개념설계 설계 구성요소 설계구현 평가/피드백 경제성/생산성 사회윤리 현실적 제한조건 심미성/사용성 안전/환경 Open-ended problem 설계 Teamwork 운영요소 Communication skills\n4주차 내용 요약: Schematic/Verilog HDL 기반 조합회로 기 강의, 토론, 실험,실습,실기 Testbench, 술 조합회로 시뮬레이션 Testbench 작성 및 조합회로 시뮬레이션 대수적 방법을 이용한 2단계 조합회로 최적화\n5주차 내용 요약: 조합회로 최적화 강의, 토론 K-Map를 이용한 2단계 조합회로 최적화 2단계 조합회로 자동 최적화 1비트 정보 저장 디지털 회로, D 플립플롭, Flip-Flop 동작 이해\n6주차 내용 요약: 강의, 토론 레지스터 Clocks 및 순차회로 기본 레지스터 동작 이해 FSM(Finite State Machine) 이해\n7주차 내용 요약: Finite State Machines 강의, 토론, 시험 FSM에 의한 순차회로 기술 방법 Controller 설계 과정 이해 Controller\n8주차 내용 요약: Controller 설계 과정에 의한 Controller ( 강의, 토론 순차회로) 설계 예 학습 Verilog HDL 에 의한 순차회로 기술 및\n9주차 내용 요약: 순차회로 시뮬레이션 강의, 토론, 실험,실습,실기 시뮬레이션 Datpath Components 소개\n10주차 내용 요약: Datapath Registers, Adders, Comparators, Multiplier, 강의, 토론 Subtractor ALU, Shiters, Counters , Timers, Register\n11주차 내용 요약: ALU, Counters, Timers 강의, 토론 files Verilog HDL 에 의한 Datapath 기술 및 시\n12주차 내용 요약: Datapath 시뮬레이션 강의, 토론, 실험,실습,실기 뮬레이션 High-Level State Machine 에 의한 디지털 RTL(Register-Transfer Level)\n13주차 내용 요약: 회로 동작 기술 강의, 토론, 실험,실습,실기 Design 과정 RTL(Register-Transfer Level) Design 과정 Behavioral-Level Design Behavioral-Level Design\n14주차 내용 요약: Memory Components 이해 강의, 토론, 실험,실습,실기 Hierarchy 기반 설계 방법 이해\n15주차 내용 요약: RTL Design Verilog HDL 에 의한 RTL Design 강의, 토론, 실험,실습,실기 [ 장애학생을 위한 강의 지원 안내 내용 ] ※ 숭실대학교 학칙 제65조의 2에 의거하여, 장애학생은 학기 시작 전후에 교과목 담당교수와 의 면담을 통해 출석, 강의, 과제 및 평가에 관한 지원 사항을 요청할 수 있으며, 요청한 사 항은 담당교수 또는 장애학생지원센터를 통해 지원받을 수 있습니다. 강의, 과제 및 평가 시, 가능한 장애유형별 지원의 예는 아래와 같습니다. 단, 실제 지원 내용은 강의 특성에 따 라 달라질 수 있습니다. [ 강의 ] 시각장애: 강의자료 제공, 대필 도우미 허용, 강의녹취 허용 지체장애: 강의자료 제공, 대필 및 수업보조 도우미 허용, 지정좌석 배정, 강의녹취 허용 청각장애: 강의..."
  },
  {
    "meta": {
      "강좌명": "머신러닝 윤진혁 동영상강의 계획서 없음",
      "담당교수": "머신러닝 윤진혁 동영상강의 계획서 없음",
      "년도": "2025학년도",
      "학기": "2학기",
      "과목코드": "2025",
      "수강대상학과": "2학년 AI융합학부,AI모빌리 이수구분",
      "필수 선수과목": "(21500145)확률및통계",
      "권장 선수과목": "교과목 개요"
    },
    "chunk": "이 강의는 '머신러닝 윤진혁 동영상강의 계획서 없음' 과목입니다. 담당 교수는 머신러닝 윤진혁 동영상강의 계획서 없음입니다.개설 정보: 2025학년도 2학기\n1. 과목개요 강좌명 담당교수 머신러닝 윤진혁 동영상강의 계획서 없음 (Course Title) (Instructor) 년도 학기 과목코드 2025학년도 2학기 2150076101 (Year) (Semester) (Course No.) 분반 수강대상학과 2학년 AI융합학부,AI모빌리 이수구분 01 전필-AI융합 (Class) (Open to) 티융합 (Course Classification) 학점/주당시간 3.0 / 03 / 3 성적스케일 점수 100기준 입력 성적평가방식 절대평가 교과목유형 이론 강의언어 상담 신청 방법 교수실 연락처 02-820-0953 이메일 (e-mail) jinhyuk.yun@ssu.ac.kr (Office) (Telephone) 이론, 문제기반학습 강좌형식 수업유형 동영상 제작년도 (PBL) 공학인증 교과목 교과영역(*) 인증구분(*) 관련 항목 (ABEEK Classification) (ABEEK Requirement) 필수 선수과목 (21500145)확률및통계 권장 선수과목  축소, 앙상블 학습 등 머신러닝의 기본 개념과 원리, 모델 구조, 학 (Course 습 알고리즘, 추론하는 방법 및 관련 수학 지식을 다룬다. Description) 교육목표 전공특화역량 AI/빅데이터 역량 기계학습이 무엇인지 이해한다. 응용 소프트웨어 역량 AI/빅데이터 역량 컴퓨터로 다양한 데이터를 다루는 방법을 이해한다. 시스템 HW/SW 개발 역량 평가항목 각 항목별 만점(최대 100점) 반영비율(합계 100%) 중간고사 30 30 기말고사 40 40 과제 20 20 출석 10 10 주요교재 *미/ISBN : 료 참고교재(대표) (Required Texts) 학습준비사항 1. \"확률 및 통계\"가 필수 선수과목으로 지정되어 있습니다. 수강학생 유의 필수적으로 수강을 한 이후에 들으셔야 하니, 본인의 수강 여부를 확인해주세요. 및 참고사항 2. EL+ 과목으로, 중간고사의 경우 프로젝트로 수행할 예정입니다. 2. 주차별 강의개요 주 핵심어 세부내용 ption) (Texts) 머신러닝의 개념, 머신러닝의 학습 프로세 01 오리엔테이션, 머신러닝의 기초 스와 종류, 머신\n1주차 내용 요약: 과목개요 강좌명 담당교수 머신러닝 윤진혁 동영상강의 계획서 없음 (Course Title) (Instructor) 년도 학기 과목코드 2025학년도 2학기 2150076101 (Year) (Semester) (Course No.) 분반 수강대상학과 2학년 AI융합학부,AI모빌리 이수구분\n2주차 내용 요약: 820-0953 이메일 (e-mail) jinhyuk.yun@ssu.ac.kr (Office) (Telephone) 이론, 문제기반학습 강좌형식 수업유형 동영상 제작년도 (PBL) 공학인증 교과목 교과영역(*) 인증구분(*) 관련 항목 (ABEEK Classification) (ABEEK Requirement) 필수 선수과목 (21500145)확률및통계 권장 선수과목 교과목 개요 본 교과목은 데이터 기반 지도학습, 비지도학습, 차원 축소, 앙상블 학습 등 머신러닝의 기본 개념과 원리, 모델 구조, 학 (Course 습 알고리즘, 추론하는 방법 및 관련 수학 지식을 다룬다. ) 교육목표 전공특화역량 AI/빅데이터 역량 기계학습이 무엇인지 이해한다. 응용 소프트웨어 역량 AI/빅데이터 역량 컴퓨터로 다양한 데이...\n3주차 내용 요약: 설계교육계획서(공학인증) 교과목명 담당교수 학점(설계학점) 설계주제 문제정의 개념설계 설계 구성요소 설계구현 평가/피드백 경제성/생산성 사회윤리 현실적 제한조건 심미성/사용성 안전/환경 Open-ended problem 설계 Teamwork 운영요소 Communication skills\n4주차 내용 요약: 판다스 강의 , 문제정의 4장 병합과 연결\n5주차 내용 요약: 데이터 시각 Matplotlib, Seaborn, Plotly 등 강의 , 아이디어 도출 5장 데이터 전처리의 기초, 데이터 전처리의\n6주차 내용 요약: 데이터 전처리 강의 , 아이디어 도출 6장 전략, 데이터 전처리의 실습 선형회귀의 개념, 선형회귀의 기초 수식, 선형회귀 기초 (8주차로 이동 가\n7주차 내용 요약: 최소자승법/경사하강법으로 선형회귀 풀 강의 , 아이디어 도출 7장 능) 기, 선형회귀 구현 배운 내용으로 중간고사를 봅니다.\n8주차 내용 요약: 중간고사 (7주차로 이동 가능) 시험 , 아이디어 도출 (EL+과목으로 프로젝트로 진행합니다) 경사하강법의 종류, 과대적합과 정규화,\n9주차 내용 요약: 선형회귀 심화 강의 , 아이디어 도출 8장 사이킷런을 이용한 선형회귀 로지스틱 회귀의 개념, 분류 문제의 성능\n10주차 내용 요약: 로지스틱 회귀 기초 강의 , 아이디어 도출 9장 지표, 로지스틱 회귀 구현 다중클래스 분류와 소프트맥스 분류, 다중\n11주차 내용 요약: 로지스틱 회귀 심화 클래스 분류를 코드로 구현, ROC 커브와 강의 , 아이디어 도출 10장 AUC 베이즈 정리, 베이즈 분류기 구현, 나이브\n12주차 내용 요약: 나이브 베이지안 강의 , 해결방안적용및 확인 11장 베이지안 분류기 구현, 분류 연습하기 의사결정트리 알고리즘, 의사결정트리의\n13주차 내용 요약: 의사결정트리 확장, 의사결정트리 알고리즘 변형, 의사 강의 , 해결방안적용및 확인 12장 결정트리 구현 앙상블의 개념, 투표 분류기, 배깅과 랜덤\n14주차 내용 요약: 앙상블 모델 강의 , 해결방안적용및 확인 13장 포레스트, 부스팅\n15주차 내용 요약: 기말고사 배운 내용으로 기말고사를 봅니다 시험 , 미적용 [ 장애학생을 위한 강의 지원 안내 내용 ] ※ 숭실대학교 학칙 제65조의 2에 의거하여, 장애학생은 학기 시작 전후에 교과목 담당교수와 의 면담을 통해 출석, 강의, 과제 및 평가에 관한 지원 사항을 요청할 수 있으며, 요청한 사 항은 담당교수 또는 장애학생지원센터를 통해 지원받을 수 있습니다. 강의, 과제 및 평가 시, 가능한 장애유형별 지원의 예는 아래와 같습니다. 단, 실제 지원 내용은 강의 특성에 따 라 달라질 수 있습니다. [ 강의 ] 시각장애: 강의자료 제공, 대필 도우미 허용, 강의녹취 허용 지체장애: 강의자료 제공, 대필 및 수업보조 도우미 허용, 지정좌석 배정, 강의녹취 허용 청각장애: 강의자료 제공, 대필/수화통역 도우미 허용 지적..."
  },
  {
    "meta": {
      "강좌명": "시스템프로그래밍 노동건 동영상강의 계획서 없음",
      "담당교수": "시스템프로그래밍 노동건 동영상강의 계획서 없음",
      "년도": "2025학년도",
      "학기": "2학기",
      "과목코드": "2025",
      "수강대상학과": "이수구분",
      "필수 선수과목": "권장 선수과목 프로그래밍및실습,컴퓨터구조",
      "권장 선수과목": "프로그래밍및실습,컴퓨터구조"
    },
    "chunk": "이 강의는 '시스템프로그래밍 노동건 동영상강의 계획서 없음' 과목입니다. 담당 교수는 시스템프로그래밍 노동건 동영상강의 계획서 없음입니다.개설 정보: 2025학년도 2학기\n1. 과목개요 강좌명 담당교수 시스템프로그래밍 노동건 동영상강의 계획서 없음 (Course Title) (Instructor) 년도 학기 과목코드 2025학년도 2학기 2150691201 (Year) (Semester) (Course No.) 분반 수강대상학과 이수구분\n1주차 내용 요약: 2학년 AI융합학부 전선-AI융합 (Class) (Open to) (Course Classification) 학점/주당시간 3.0 (0 ) / 3 성적스케일 점수 100기준 입력 성적평가방식 상대평가 교과목유형 이론 강의언어 상담 신청 방법 교수실 연락처 형남공학관1112호 02-820-0636 이메일 (e-mail) dnoh@ssu.ac.kr (Office) (Telephone) 이론, 문제기반학습 강좌형식 수업유형 동영상 제작년도 (PBL) 공학인증 교과목 교과영역(*) 인증구분(*) 관련 항목 (ABEEK Classification) (ABEEK Requirement) 필수 선수과목 권장 선수과목 프로그래밍및실습,컴퓨터구조 교과목 개요 어셈블러, 링커, 로더, 컴파일러, 디버거, 운영체제 등 시스템 소...\n2주차 내용 요약: 주차별 강의개요 주 (Week) ( ) ( ) ( ) Chapter 1: A Tour of Computer Systems - Overview Chapter 1\n3주차 내용 요약: Floating Point 강의 , 미적용 Chapter 2 Manipulating Information - Optimizing Program Performance: Basic Chapter 5: Optimizing Program - Optimizing Program Performance:\n4주차 내용 요약: 강의 , 문제정의 Chapter 5 Performance Advanced 강의, 실험,실습,실기 , 아이디\n5주차 내용 요약: Chapter 6: The Memory Hierarchy - Memory Hierarchy Chapter 6 어 도출 Chapter 7: Linking - Linking: Basic\n6주차 내용 요약: 강의 , 미적용 Chapter 7 - Linking: Advanced Chapter 7: Linking - Linking: Basic\n7주차 내용 요약: 강의, 실험,실습,실기 , 미적용 Chapter 7 - Linking: Advanced - 중간고사 / 중간고사 / 중간고사 / 중간고\n8주차 내용 요약: 중간고사 시험 , 미적용 사 Chapter 8: Exceptional Control - ECF: Exceptions & Processes\n9주차 내용 요약: Flow 강의 , 미적용 Chapter 8 Chapter 8: Exceptional Control\n10주차 내용 요약: Flow - ECF: Signals & Nonlocal Jumps 강의 , 미적용 Chapter 8 Chapter 10: System-Level I/O - System Level I/O: Baisic\n11주차 내용 요약: 강의 , 미적용 Chapter 10\n12주차 내용 요약: Chapter 11: Network Programming - System Level I/O: Advanced 강의 , 미적용 Chapter 11 - Internetworking\n13주차 내용 요약: Chapter 11: Network Programming 강의 , 미적용 Chapter 11 - Network Programming Chapter 12: Concurrent - Web Services 강의, 실험,실습,실기 , 해결방\n14주차 내용 요약: Chapter 12 Programming - Concurrent Programming 안적용및 확인 - 기말고사 / 기말고사 / 기말고사 / 기말고\n15주차 내용 요약: 기말고사 시험 , 미적용 사 [ 장애학생을 위한 강의 지원 안내 내용 ] ※ 숭실대학교 학칙 제65조의 2에 의거하여, 장애학생은 학기 시작 전후에 교과목 담당교수와 의 면담을 통해 출석, 강의, 과제 및 평가에 관한 지원 사항을 요청할 수 있으며, 요청한 사 항은 담당교수 또는 장애학생지원센터를 통해 지원받을 수 있습니다. 강의, 과제 및 평가 시, 가능한 장애유형별 지원의 예는 아래와 같습니다. 단, 실제 지원 내용은 강의 특성에 따 라 달라질 수 있습니다. [ 강의 ] 시각장애: 강의자료 제공, 대필 도우미 허용, 강의녹취 허용 지체장애: 강의자료 제공, 대필 및 수업보조 도우미 허용, 지정좌석 배정, 강의녹취 허용 청각장애: 강의자료 제공, 대필/수화통역 도우미 허용 지적장애/자폐성장애: 강의자료 제..."
  },
  {
    "meta": {
      "강좌명": "알고리즘 이길호 동영상강의 계획서 없음",
      "담당교수": "알고리즘 이길호 동영상강의 계획서 없음",
      "년도": "2025학년도",
      "학기": "2학기",
      "과목코드": "2025",
      "수강대상학과": "2학년 AI융합학부,빅데이터융합,스 이수구분 전선-AI융합",
      "필수 선수과목": "자료구조",
      "권장 선수과목": "고급프로그래밍 (C++)"
    },
    "chunk": "이 강의는 '알고리즘 이길호 동영상강의 계획서 없음' 과목입니다. 담당 교수는 알고리즘 이길호 동영상강의 계획서 없음입니다.개설 정보: 2025학년도 2학기\n1. 과목개요 강좌명 담당교수 알고리즘 이길호 동영상강의 계획서 없음 (Course Title) (Instructor) 년도 학기 과목코드 2025학년도 2학기 2150014001 (Year) (Semester) (Course No.) 분반 01 수강대상학과 2학년 AI융합학부,빅데이터융합,스 이수구분 전선-AI융합 (Class) (Open to) 마트자동차융합,AI모빌리티융합 (Course Classification) 학점/주당시간 3.0 / 03 / 3 성적스케일 점수 100기준 입력 성적평가방식 상대평가 교과목유형 이론 강의언어 상담 신청 방법 교수실 연락처 벤처관709 0954 이메일 (e-mail) khlee.cs@ssu.ac.kr (Office) (Telephone) 이론, 문제기반학습 강좌형식 수업유형 동영상 제작년도 (PBL) 공학인증 교과목 교과영역(*) 인증구분(*) 관련 항목 (ABEEK Classification) (ABEEK Requirement) 필수 선수과목 자료구조 권장 선수과목 고급프로그래밍 (C++) 절차들로 바꾸어 문제를 해결하는 방법을 divide-and-conquer, (Course greedy method, 동적 프로그래밍, branch-and-bound 등 대표적인 알고리즘들을 통하여 학습한다. Description) 교육목표 전공특화역량 AI/빅데이터 역량 알고리즘 및 컴퓨팅적 사고를 위한 기초지식 습득 응용 소프트웨어 역량 AI/빅데이터 역량 프로그래밍 문제 분석 및 해결 방법 모델링 응용 소프트웨어 역량 복잡도에 대한 이해를 바탕으로 효과적인 문제 해결 시스템 HW/SW 개발 역량 알고리즘 설계에 기반한 효과적인 구현 능력 배양 자율주행 개발 역량 평가항목 각 항목별 만점(최대 100점) 반영비율(합계 100%) 중간고사 35 35 기말고사 35 35 과제 20 20 출석 10 10 Algorithms/Thomas H. Cormen et al/The MIT Press/2022/4th Edition/ ) *참고교재/쉽게 배우는 알고리즘/문병로/한빛아카데미/2018/지정도서 자료구조 학습준비사항 C++ 프로그래밍 언어 수업: 주요 알고리즘 이론 및 C/C++ 기준 구현 예시 학습 수강학생\n1주차 내용 요약: 과목개요 강좌명 담당교수 알고리즘 이길호 동영상강의 계획서 없음 (Course Title) (Instructor) 년도 학기 과목코드 2025학년도 2학기 2150014001 (Year) (Semester) (Course No.) 분반 01 수강대상학과 2학년 AI융합학부,빅데이터융합,스 이수구분 전선-AI융합 (Class) (Open to) 마트자동차융합,AI모빌리티융합 (Course Classification) 학점/주당시간 3.0 / 03 / 3 성적스케일 점수 100기준 입력 성적평가방식 상대평가 교과목유형 이론 강의언어 상담 신청 방법 교수실 연락처 벤처관709 0954 이메일 (e-mail) khlee.cs@ssu.ac.kr (Office) (Telephone) 이론, 문제기반학습 강좌형식 수업유...\n2주차 내용 요약: 주차별 강의개요 주 (Week) ( ) ( ) ( ) - algorithm overview\n3주차 내용 요약: 설계교육계획서(공학인증) 교과목명 담당교수 학점(설계학점) 설계주제 문제정의 개념설계 설계 구성요소 설계구현 평가/피드백 경제성/생산성 사회윤리 현실적 제한조건 심미성/사용성 안전/환경 Open-ended problem 설계 Teamwork 운영요소 Communication skills\n4주차 내용 요약: Divide and conquer 강의 - linear-time selection Advanced sorting & randomized - linear-time sorting\n5주차 내용 요약: 강의 algorithms - hashing - tree data structure\n6주차 내용 요약: Tree algorithms - binary search tree 강의, 실험,실습,실기 - balanced binary search tree - graph data structure\n7주차 내용 요약: Graph algorithms 강의 - graph search algorithms - graph search: DFS and BFS\n8주차 내용 요약: 중간고사 강의, 시험 - 중간고사 - topological ordering\n9주차 내용 요약: Graph algorithms 강의, 실험,실습,실기 - shortest path finding - dynamic programming paradigm\n10주차 내용 요약: Dynamic programming - elements of DP 강의 - Bellman-Ford algorithm - Floyd-Warshall algorithm\n11주차 내용 요약: Dynamic programming - longest common subsequence 강의 - knapsack - independent sets Dynamic programming - greedy paradigm\n12주차 내용 요약: 강의, 실험,실습,실기 Greedy algorithms - activity scheduling - Huffman coding\n13주차 내용 요약: Greedy algorithms - minimum spanning tree (Prim's and 강의 Kruskal's) - NP and NP-hard\n14주차 내용 요약: NP completeness 강의 - NP completeness - 3-SAT\n15주차 내용 요약: 기말고사 - clique 강의, 시험 - 기말고사 [ 장애학생을 위한 강의 지원 안내 내용 ] ※ 숭실대학교 학칙 제65조의 2에 의거하여, 장애학생은 학기 시작 전후에 교과목 담당교수와 의 면담을 통해 출석, 강의, 과제 및 평가에 관한 지원 사항을 요청할 수 있으며, 요청한 사 항은 담당교수 또는 장애학생지원센터를 통해 지원받을 수 있습니다. 강의, 과제 및 평가 시, 가능한 장애유형별 지원의 예는 아래와 같습니다. 단, 실제 지원 내용은 강의 특성에 따 라 달라질 수 있습니다. [ 강의 ] 시각장애: 강의자료 제공, 대필 도우미 허용, 강의녹취 허용 지체장애: 강의자료 제공, 대필 및 수업보조 도우미 허용, 지정좌석 배정, 강의녹취 허용 청각장애: 강의자료 제공, 대필/수화통역 도우미 허용 지적장애/자..."
  },
  {
    "meta": {
      "강좌명": "웹프로그래밍 한상호 동영상강의 계획서 없음",
      "담당교수": "웹프로그래밍 한상호 동영상강의 계획서 없음",
      "년도": "2025학년도",
      "학기": "2학기",
      "과목코드": "2025",
      "수강대상학과": "이수구분",
      "필수 선수과목": "권장 선수과목",
      "권장 선수과목": "교과목 개요"
    },
    "chunk": "이 강의는 '웹프로그래밍 한상호 동영상강의 계획서 없음' 과목입니다. 담당 교수는 웹프로그래밍 한상호 동영상강의 계획서 없음입니다.개설 정보: 2025학년도 2학기\n1. 과목개요 강좌명 담당교수 웹프로그래밍 한상호 동영상강의 계획서 없음 (Course Title) (Instructor) 년도 학기 과목코드 2025학년도 2학기 2150030101 (Year) (Semester) (Course No.) 분반 수강대상학과 이수구분\n1주차 내용 요약: 2학년 AI융합학부 전선-AI융합 (Class) (Open to) (Course Classification) 학점/주당시간 3.0 / 03 / 3 성적스케일 점수 100기준 입력 성적평가방식 상대평가 교과목유형 이론 강의언어 상담 신청 방법 이메일 교수실 연락처 전산관310호 02-828-7283 이메일 (e-mail) scotthan321@gmail.com (Office) (Telephone) 이론, 플립러닝(FL), 문제기반 강좌형식 수업유형 동영상 제작년도 학습(PBL), 팀기반 학습(TBL) 공학인증 교과목 교과영역(*) 인증구분(*) 관련 항목 (ABEEK Classification) (ABEEK Requirement) 필수 선수과목 권장 선수과목 교과목 개요 Web 플랫폼 상에서 사용자에게 기능성...\n2주차 내용 요약: 주차별 강의개요 주 (Week) ( ) ( ) ( ) . Web Standard 소개\n3주차 내용 요약: 설계교육계획서(공학인증) 교과목명 담당교수 학점(설계학점) 설계주제 문제정의 개념설계 설계 구성요소 설계구현 평가/피드백 경제성/생산성 사회윤리 현실적 제한조건 심미성/사용성 안전/환경 Open-ended problem 설계 Teamwork 운영요소 Communication skills\n4주차 내용 요약: JavaScript 개요 . Data type 사용, 제어문 등 기초 문법 소개 강의, 실험,실습,실기\n5주차 내용 요약: Bootstrap library 개요 . Bootstrap library 소개 및 실습 강의, 실험,실습,실기\n6주차 내용 요약: JavaScript 내장 객체(Object) . JavaScript 내장 객체 소개 및 실습 강의, 실험,실습,실기\n7주차 내용 요약: JavaScript 함수 . JavaScript 함수 소개 및 실습 강의, 실험,실습,실기\n8주차 내용 요약: 중간 고사 . 중간 고사 (필기 시험) 강의, 시험\n9주차 내용 요약: JavaScript Class . JavaScript Class 소개 및 실습 강의, 실험,실습,실기\n10주차 내용 요약: JavaScript Web Browser . JavaScript Web Browser 소개 및 실습 강의, 실험,실습,실기\n11주차 내용 요약: jQuery library 개요(1) . jQuery library 개념 소개 및 실습 강의, 실험,실습,실기\n12주차 내용 요약: jQuery library 개요(2) . jQuery library 개념 소개 및 실습 강의, 실험,실습,실기\n13주차 내용 요약: Node.js 개요 . Node.js 개념 소개 및 실습 강의, 실험,실습,실기\n14주차 내용 요약: Ajax 개요 . Ajax 개념 소개 및 실습 강의, 실험,실습,실기\n15주차 내용 요약: 기말 고사 . 기말 고사 (필기 시험) 시험 [ 장애학생을 위한 강의 지원 안내 내용 ] ※ 숭실대학교 학칙 제65조의 2에 의거하여, 장애학생은 학기 시작 전후에 교과목 담당교수와 의 면담을 통해 출석, 강의, 과제 및 평가에 관한 지원 사항을 요청할 수 있으며, 요청한 사 항은 담당교수 또는 장애학생지원센터를 통해 지원받을 수 있습니다. 강의, 과제 및 평가 시, 가능한 장애유형별 지원의 예는 아래와 같습니다. 단, 실제 지원 내용은 강의 특성에 따 라 달라질 수 있습니다. [ 강의 ] 시각장애: 강의자료 제공, 대필 도우미 허용, 강의녹취 허용 지체장애: 강의자료 제공, 대필 및 수업보조 도우미 허용, 지정좌석 배정, 강의녹취 허용 청각장애: 강의자료 제공, 대필/수화통역 도우미 허용 지적장애/자폐성장..."
  },
  {
    "meta": {
      "강좌명": "자율주행프로그래밍 김강희 동영상강의 계획서 없음",
      "담당교수": "자율주행프로그래밍 김강희 동영상강의 계획서 없음",
      "년도": "2025학년도",
      "학기": "2학기",
      "과목코드": "2025",
      "수강대상학과": "2학년 AI융합학부,스마트자 이수구분",
      "필수 선수과목": "권장 선수과목 고급프로그래밍및실습, 확률및통계, 고급AI수학",
      "권장 선수과목": "고급프로그래밍및실습, 확률및통계, 고급AI수학"
    },
    "chunk": "이 강의는 '자율주행프로그래밍 김강희 동영상강의 계획서 없음' 과목입니다. 담당 교수는 자율주행프로그래밍 김강희 동영상강의 계획서 없음입니다.개설 정보: 2025학년도 2학기\n1. 과목개요 강좌명 담당교수 자율주행프로그래밍 김강희 동영상강의 계획서 없음 (Course Title) (Instructor) 년도 학기 과목코드 2025학년도 2학기 2150076401 (Year) (Semester) (Course No.) 분반 수강대상학과 2학년 AI융합학부,스마트자 이수구분\n1주차 내용 요약: 전선-AI융합 (Class) (Open to) 동차융합 (Course Classification) 학점/주당시간 3.0 / 03 / 3 성적스케일 점수 100기준 입력 성적평가방식 절대평가 교과목유형 이론 강의언어 상담 신청 방법 이메일 교수실 연락처 형남공학관1009호 02-828-7193 이메일 (e-mail) khkim@ssu.ac.kr (Office) (Telephone) 이론, 문제기반학습(PBL), 강좌형식 수업유형 동영상 제작년도 팀기반 학습(TBL) 공학인증 교과목 교과영역(*) 인증구분(*) 관련 항목 (ABEEK Classification) (ABEEK Requirement) 필수 선수과목 권장 선수과목 고급프로그래밍및실습, 확률및통계, 고급AI수학 교과목 개요 1. 자율주행차량의 컴퓨팅...\n2주차 내용 요약: 주차별 강의개요 주 (Week) ( ) ( ) ( ) [EL 프로젝트 소개] 자율주행 기술 수준 및\n3주차 내용 요약: 설계교육계획서(공학인증) 교과목명 담당교수 학점(설계학점) 설계주제 문제정의 개념설계 설계 구성요소 설계구현 평가/피드백 경제성/생산성 사회윤리 현실적 제한조건 심미성/사용성 안전/환경 Open-ended problem 설계 Teamwork 운영요소 Communication skills\n4주차 내용 요약: 경로계획 1 강의, 시험 , 미적용 반) 전역적 경로 생성(최단경로, Astar, 레이스\n5주차 내용 요약: 경로계획 2 강의 , 미적용 라인 최적화)\n6주차 내용 요약: 측위 라이더 측위(ICP, NDT), GNSS 측위 강의 , 미적용\n7주차 내용 요약: 지도 제작 그래프 슬램(Graph-based SLAM) 강의, 시험 , 미적용 [EL 프로젝트 제안 발표(문제 정의)] rospy 강의, 발표, 실험,실습,실기 ,\n8주차 내용 요약: ROS 프로그래밍 1 패키지 작성, 빌드, 실행 문제정의\n9주차 내용 요약: 상태추정 1 상태추정: 베이즈 필터, 칼만 필터 강의 , 미적용\n10주차 내용 요약: 상태추정 2 상태추정: 확장 칼만 필터, 무향 칼만 필터 강의, 시험 , 미적용 [EL 프로젝트 중간 발표(아이디어 도출)]\n11주차 내용 요약: 상태추정 3 강의 , 아이디어 도출 상태추정: 파티클 필터\n12주차 내용 요약: 레이스 스택 사례 연구 1 ForzaETH: Perception (Ego vs. Opponent) 강의 , 미적용\n13주차 내용 요약: 레이스 스택 사례 연구 2 ForzaETH: Planning & Control 강의, 시험 , 미적용\n14주차 내용 요약: ROS 프로그래밍 2 roscpp 패키지 작성, 빌드, 실행 강의, 실험,실습,실기 , 미적용 [EL 프로젝트 최종 발표(해결방안 적용 및\n15주차 내용 요약: 프로젝트 발표 발표 , 해결방안적용및 확인 확인)] [ 장애학생을 위한 강의 지원 안내 내용 ] ※ 숭실대학교 학칙 제65조의 2에 의거하여, 장애학생은 학기 시작 전후에 교과목 담당교수와 의 면담을 통해 출석, 강의, 과제 및 평가에 관한 지원 사항을 요청할 수 있으며, 요청한 사 항은 담당교수 또는 장애학생지원센터를 통해 지원받을 수 있습니다. 강의, 과제 및 평가 시, 가능한 장애유형별 지원의 예는 아래와 같습니다. 단, 실제 지원 내용은 강의 특성에 따 라 달라질 수 있습니다. [ 강의 ] 시각장애: 강의자료 제공, 대필 도우미 허용, 강의녹취 허용 지체장애: 강의자료 제공, 대필 및 수업보조 도우미 허용, 지정좌석 배정, 강의녹취 허용 청각장애: 강의자료 제공, 대필/수화통역 도우미 허용 지적장애/..."
  },
  {
    "meta": {
      "강좌명": "이길호 동영상강의 계획서 없음",
      "담당교수": "이길호 동영상강의 계획서 없음",
      "년도": "2025학년도",
      "학기": "2학기",
      "과목코드": "2025",
      "수강대상학과": "3학년 AI융합학부,스마트자 이수구분",
      "필수 선수과목": "C/C++",
      "권장 선수과목": "Python"
    },
    "chunk": "이 강의는 '이길호 동영상강의 계획서 없음' 과목입니다. 담당 교수는 이길호 동영상강의 계획서 없음입니다.개설 정보: 2025학년도 2학기\n1. 과목개요 강좌명 AI임베디드프로그래 담당교수 이길호 동영상강의 계획서 없음 (Course Title) 밍 (Instructor) 년도 학기 과목코드 2025학년도 2학기 2150031101 (Year) (Semester) (Course No.) 분반 수강대상학과 3학년 AI융합학부,스마트자 이수구분\n1주차 내용 요약: 전선-AI융합 (Class) (Open to) 동차융합 (Course Classification) 학점/주당시간 3.0 / 03 / 3 성적스케일 점수 100기준 입력 성적평가방식 절대평가 교과목유형 이론 강의언어 상담 신청 방법 교수실 연락처 벤처관709 0954 이메일 (e-mail) khlee.cs@ssu.ac.kr (Office) (Telephone) 이론, 토론식수업, 문제기반 강좌형식 수업유형 동영상 제작년도 학습(PBL), 팀기반 학습(TBL) 공학인증 교과목 교과영역(*) 인증구분(*) 관련 항목 (ABEEK Classification) (ABEEK Requirement) 필수 선수과목 C/C++ 권장 선수과목 Python 시스템 프로그래밍 교과목 개요 기존의 자동차, 공장 등으로 대표되던 임...\n2주차 내용 요약: 주차별 강의개요 주 (Week) ( ) ( ) ( ) - 다양한 임베디드 시스템 소개\n3주차 내용 요약: 설계교육계획서(공학인증) 교과목명 담당교수 학점(설계학점) 설계주제 문제정의 개념설계 설계 구성요소 설계구현 평가/피드백 경제성/생산성 사회윤리 현실적 제한조건 심미성/사용성 안전/환경 Open-ended problem 설계 Teamwork 운영요소 Communication skills\n4주차 내용 요약: Embedded I/O. 1 - GPIO 프로그래밍 1 의 - (EL) 1단계 문제정의 - GPIO 프로그래밍 2\n5주차 내용 요약: Embedded I/O. 2 - LED, switch 강의, 실험,실습,실기 , 미적용 - Sensors - Real-time systems\n6주차 내용 요약: Real-time embedded systems 강의, 토론 , 미적용 - Embedded operating systems - 시리얼 통신\n7주차 내용 요약: Embedded communication 강의, 실험,실습,실기 , 미적용 - I2C, SPI, UART - 임베디드 비전 센서 강의, 실험,실습,실기 , 아이디\n8주차 내용 요약: Embedded vision - OpenCV tutorial 어 도출 - (EL) 2단계 아이디어 도출 - 인공지능 및 기계학습 개요\n9주차 내용 요약: Machine learning overview 강의, 토론 , 미적용 - 온디바이스 기계학습 개요\n10주차 내용 요약: On-device ML 강의, 실험,실습,실기 , 미적용 - 온디바이스 기계학습 프레임워크 실습 - 온디바이스 기계학습 가속기\n11주차 내용 요약: On-device ML acceleration. 1 강의, 실험,실습,실기 , 미적용 - Edge TPU - 경량화 기법 소개 강의, 토론, 실험,실습,실기 ,\n12주차 내용 요약: On-device ML acceleration. 2 - Quantization/ Pruning 미적용 - 최신 연구 특강 - 프로젝트 최종 결과 발표 발표, 토론 , 해결방안적용및\n13주차 내용 요약: 프로젝트 최종 발표 - (EL) 3단계 해결방안적용및확인 확인 - 프로젝트 최종 결과 발표 발표, 토론 , 해결방안적용및\n14주차 내용 요약: 프로젝트 최종 발표 - (EL) 3단계 해결방안적용및확인 확인 - 기말고사\n15주차 내용 요약: 기말고사 - (EL) 3단계 해결방안적용및확인 시험 , 해결방안적용및 확인 [ 장애학생을 위한 강의 지원 안내 내용 ] ※ 숭실대학교 학칙 제65조의 2에 의거하여, 장애학생은 학기 시작 전후에 교과목 담당교수와 의 면담을 통해 출석, 강의, 과제 및 평가에 관한 지원 사항을 요청할 수 있으며, 요청한 사 항은 담당교수 또는 장애학생지원센터를 통해 지원받을 수 있습니다. 강의, 과제 및 평가 시, 가능한 장애유형별 지원의 예는 아래와 같습니다. 단, 실제 지원 내용은 강의 특성에 따 라 달라질 수 있습니다. [ 강의 ] 시각장애: 강의자료 제공, 대필 도우미 허용, 강의녹취 허용 지체장애: 강의자료 제공, 대필 및 수업보조 도우미 허용, 지정좌석 배정, 강의녹취 허용 청각장애: 강의자료 제공, 대필/수화통역..."
  },
  {
    "meta": {
      "강좌명": "모바일프로그래밍 최종수 동영상강의 계획서 없음",
      "담당교수": "모바일프로그래밍 최종수 동영상강의 계획서 없음",
      "년도": "2025학년도",
      "학기": "2학기",
      "과목코드": "2025",
      "수강대상학과": "3학년 AI융합학부,스마트자 이수구분",
      "필수 선수과목": "권장 선수과목 Java 언어를 알고 있으면 학습에 많은 도움이됨.",
      "권장 선수과목": "Java 언어를 알고 있으면 학습에 많은 도움이됨."
    },
    "chunk": "이 강의는 '모바일프로그래밍 최종수 동영상강의 계획서 없음' 과목입니다. 담당 교수는 모바일프로그래밍 최종수 동영상강의 계획서 없음입니다.개설 정보: 2025학년도 2학기\n1. 과목개요 강좌명 담당교수 모바일프로그래밍 최종수 동영상강의 계획서 없음 (Course Title) (Instructor) 년도 학기 과목코드 2025학년도 2학기 2150686801 (Year) (Semester) (Course No.) 분반 수강대상학과 3학년 AI융합학부,스마트자 이수구분\n1주차 내용 요약: 전선-AI융합 (Class) (Open to) 동차융합,빅데이터융합 (Course Classification) 학점/주당시간 3.0 (0 ) / 3 성적스케일 점수 100기준 입력 성적평가방식 절대평가 교과목유형 이론 강의언어 상담 신청 방법 LMS 공지 참조 교수실 벤처중소기업센터502 연락처\n2주차 내용 요약: 820-0879 이메일 (e-mail) jongsoo.choi@ssu.ac.kr (Office) 호 (Telephone) 이론, 토론식수업, 문제기반 강좌형식 수업유형 동영상 제작년도 학습(PBL), 팀기반 학습(TBL) 공학인증 교과목 교과영역(*) 인증구분(*) 관련 항목 (ABEEK Classification) (ABEEK Requirement) 필수 선수과목 권장 선수과목 Java 언어를 알고 있으면 학습에 많은 도움이됨. 교과목 개요 모바일 플랫폼 위에서 응용의 생명 주기, 이벤트 핸들러 구조, MVC (Model-View-Controller) 모델 등 모바일 응용의 핵심 (Course 개념을 학습하고 다양한 라이브러리를 활용하는 응용 프로그램 작성 실습을 통해서 실용적인 프로그래밍 방법과 폭넓 )...\n3주차 내용 요약: 설계교육계획서(공학인증) 교과목명 담당교수 학점(설계학점) 설계주제 문제정의 개념설계 설계 구성요소 설계구현 평가/피드백 경제성/생산성 사회윤리 현실적 제한조건 심미성/사용성 안전/환경 Open-ended problem 설계 Teamwork 운영요소 Communication skills\n4주차 내용 요약: 앱 패키지의 구조 강의, 실험,실습,실기 , 미적용 주교재 2장, 참고1 2장 니페스트 주교재 3장, 참고1 4장,\n5주차 내용 요약: 기본 위젯 View, Button, Edit 등 강의, 실험,실습,실기 , 미적용 참고2 둘째마당 3장 주교재 4&5장, 참고1 5 Layout 종류, LinearLayout, 이벤트 종류,\n6주차 내용 요약: 레이아웃, 이벤트 처리 강의, 실험,실습,실기 , 미적용 장, 참고2 둘째마당 2 EventListener 장 주교재 6장, 참고1 10 액티비티와 태스크, 인텐트, 인텐트 필터,\n7주차 내용 요약: 액티비티와 인텐트 강의, 실험,실습,실기 , 미적용 장, 참고2 둘째마당 4 액티비티 생명주기 장 강의, 토론, 실험,실습,실기 ,\n8주차 내용 요약: 메뉴와 대화상자 메뉴, 대화 상자, 알림 주교재 7장, 참고1 7장 문제정의 - CustomView, Canvas Drawing, Touch 강의, 토론, 실험,실습,실기 ,\n9주차 내용 요약: 그래픽과 터치 이벤트 처리 Event 처리 주교재 9장, 참고1 9장 문제정의 - 팀프로젝트 제안서 제출\n10주차 내용 요약: 리소스와 권한 리소스, 리소스 참조, 권한 요청 강의, 실험,실습,실기 , 미적용 주교재 10장, 강의, 토론, 실험,실습,실기 ,\n11주차 내용 요약: 스레드와 게임 스레드, SurfaceView, 게임 앱 구조 주교재 13장 아이디어 도출 1주차부터 11주차까지의 내용에 대한 지\n12주차 내용 요약: 기말시험 시험 , 미적용 N.A. 필 평가 - 네트워킹 상태조회, 웹에서 파일 다운로 강의, 토론, 실험,실습,실기 , 주교재 14장, 참고2 둘\n13주차 내용 요약: 네트워크 드, 웹앱 해결방안적용및 확인 째마당 10장 - 팀프로젝트 결과보고서 제출\n14주차 내용 요약: 팀프로젝트 결과 발표1 팀프로젝트 결과 발표 및 평가 발표 , 해결방안적용및 확인 N.A.\n15주차 내용 요약: 팀프로젝트 결과 발표2 팀프로젝트 결과 발표 및 평가 발표 , 해결방안적용및 확인 N.A. [ 장애학생을 위한 강의 지원 안내 내용 ] ※ 숭실대학교 학칙 제65조의 2에 의거하여, 장애학생은 학기 시작 전후에 교과목 담당교수와 의 면담을 통해 출석, 강의, 과제 및 평가에 관한 지원 사항을 요청할 수 있으며, 요청한 사 항은 담당교수 또는 장애학생지원센터를 통해 지원받을 수 있습니다. 강의, 과제 및 평가 시, 가능한 장애유형별 지원의 예는 아래와 같습니다. 단, 실제 지원 내용은 강의 특성에 따 라 달라질 수 있습니다. [ 강의 ] 시각장애: 강의자료 제공, 대필 도우미 허용, 강의녹취 허용 지체장애: 강의자료 제공, 대필 및 수업보조 도우미 허용, 지정좌석 배정, 강의녹취 허용 청각장애: 강의자료 제공..."
  },
  {
    "meta": {
      "강좌명": "고급캡스톤디자인 신동화 동영상강의 계획서 없음",
      "담당교수": "고급캡스톤디자인 신동화 동영상강의 계획서 없음",
      "년도": "2025학년도",
      "학기": "2학기",
      "과목코드": "2025",
      "수강대상학과": "이수구분",
      "필수 선수과목": "권장 선수과목 없음",
      "권장 선수과목": null
    },
    "chunk": "이 강의는 '고급캡스톤디자인 신동화 동영상강의 계획서 없음' 과목입니다. 담당 교수는 고급캡스톤디자인 신동화 동영상강의 계획서 없음입니다.개설 정보: 2025학년도 2학기\n1. 과목개요 강좌명 담당교수 고급캡스톤디자인 신동화 동영상강의 계획서 없음 (Course Title) (Instructor) 년도 학기 과목코드 2025학년도 2학기 2150030701 (Year) (Semester) (Course No.) 분반 수강대상학과 이수구분\n1주차 내용 요약: 4학년 AI융합학부 전선-AI융합 (Class) (Open to) (Course Classification) 학점/주당시간 3.0 / 03 / 3 성적스케일 Pass/Fail 입력 성적평가방식 절대평가 교과목유형 이론 강의언어 상담 신청 방법 이메일 교수실 연락처 전산관529호 02-828-0956 이메일 (e-mail) kss0222@ssu.ac.kr (Office) (Telephone) 강좌형식 토론식수업, 플립러닝(FL), 문제기 수업유형 동영상 제작년도 반학습(PBL), 팀기반 학습(TBL) 공학인증 교과목 교과영역(*) 인증구분(*) 관련 항목 (ABEEK Classification) (ABEEK Requirement) 필수 선수과목 권장 선수과목 없음 교과목 개요 본 설계 과목에서는 지능형 전자시...\n2주차 내용 요약: 주차별 강의개요 주 (Week) ( ) ( ) ( ) . 공학설계 개념 소개 . 교과 과정 및 평가 소개\n3주차 내용 요약: 설계교육계획서(공학인증) 교과목명 담당교수 학점(설계학점) 설계주제 문제정의 개념설계 설계 구성요소 설계구현 평가/피드백 경제성/생산성 사회윤리 현실적 제한조건 심미성/사용성 안전/환경 Open-ended problem 설계 Teamwork 운영요소 Communication skills\n4주차 내용 요약: 졸업작품 선정결과 및 추진계획 발표 강의, 발표, 토론, 팀티칭 별도 자료 발표 II 졸업작품 선정 및 추진계획서\n5주차 내용 요약: 졸업작품 선정결과 및 추진계획 발표 강의, 발표, 토론, 팀티칭 별도 자료 발표 III 별도 자료 및 외부 동\n6주차 내용 요약: 취업 동향 소개 IT 기업 취업 동향 소개 강의, 발표, 토론 영상 소개\n7주차 내용 요약: 졸업작품 중간 발표 I 졸업작품 진행 상황 및 수정 계획 발표 강의, 발표, 토론, 팀티칭 별도 자료\n8주차 내용 요약: 졸업작품 중간 발표 II 졸업작품 진행 상황 및 수정 계획 발표 강의, 발표, 토론, 팀티칭 별도 자료\n9주차 내용 요약: 졸업작품 중간 발표 III 졸업작품 진행 상황 및 수정 계획 발표 강의, 발표, 토론, 팀티칭 별도 자료\n10주차 내용 요약: 팀미팅 I 실험 및 토의, 테스트 강의, 발표, 토론 별도 자료\n11주차 내용 요약: 팀미팅 II 실험 및 토의, 테스트 강의, 발표, 토론 별도 자료\n12주차 내용 요약: 팀미팅 III 실험 및 토의, 테스트 강의, 발표, 토론 별도 자료\n13주차 내용 요약: 최종 과제물 발표 I 졸업작품 수행 내용 및 최종 결과물 발표 강의, 발표, 토론, 팀티칭 별도 자료\n14주차 내용 요약: 최종 과제물 발표 II 졸업작품 수행 내용 및 최종 결과물 발표 강의, 발표, 토론, 팀티칭 별도 자료\n15주차 내용 요약: 최종 과제물 발표 III 졸업작품 수행 내용 및 최종 결과물 발표 강의, 발표, 토론, 팀티칭 별도 자료 [ 장애학생을 위한 강의 지원 안내 내용 ] ※ 숭실대학교 학칙 제65조의 2에 의거하여, 장애학생은 학기 시작 전후에 교과목 담당교수와 의 면담을 통해 출석, 강의, 과제 및 평가에 관한 지원 사항을 요청할 수 있으며, 요청한 사 항은 담당교수 또는 장애학생지원센터를 통해 지원받을 수 있습니다. 강의, 과제 및 평가 시, 가능한 장애유형별 지원의 예는 아래와 같습니다. 단, 실제 지원 내용은 강의 특성에 따 라 달라질 수 있습니다. [ 강의 ] 시각장애: 강의자료 제공, 대필 도우미 허용, 강의녹취 허용 지체장애: 강의자료 제공, 대필 및 수업보조 도우미 허용, 지정좌석 배정, 강의녹취 허용 청각장애:..."
  },
  {
    "meta": {
      "강좌명": "멀티모달딥러닝 박승현 동영상강의 계획서 없음",
      "담당교수": "멀티모달딥러닝 박승현 동영상강의 계획서 없음",
      "년도": "2025학년도",
      "학기": "2학기",
      "과목코드": "2025",
      "수강대상학과": "이수구분",
      "필수 선수과목": "권장 선수과목 딥러닝, 머신러닝, 컴퓨터비전, 자연언어처리, 프로그래밍 및 실습, 확률 및 통계, 미적분학, 선형대수학",
      "권장 선수과목": "딥러닝, 머신러닝, 컴퓨터비전, 자연언어처리, 프로그래밍 및 실습, 확률 및 통계, 미적분학, 선형대수학"
    },
    "chunk": "이 강의는 '멀티모달딥러닝 박승현 동영상강의 계획서 없음' 과목입니다. 담당 교수는 멀티모달딥러닝 박승현 동영상강의 계획서 없음입니다.개설 정보: 2025학년도 2학기\n1. 과목개요 강좌명 담당교수 멀티모달딥러닝 박승현 동영상강의 계획서 없음 (Course Title) (Instructor) 년도 학기 과목코드 2025학년도 2학기 2150156101 (Year) (Semester) (Course No.) 분반 수강대상학과 이수구분\n1주차 내용 요약: 4학년 AI융합학부 전선-AI융합 (Class) (Open to) (Course Classification) 학점/주당시간 3.0 / 03 / 3 성적스케일 점수 100기준 입력 성적평가방식 절대평가 교과목유형 이론 강의언어 상담 신청 방법 email 교수실 연락처 연구관111호 02-850-1415 이메일 (e-mail) sh.park@ssu.ac.kr (Office) (Telephone) 강좌형식 이론, 토론식수업, 플립러닝(FL), 문제기 수업유형 동영상 제작년도 반학습(PBL), 팀기반 학습(TBL) 공학인증 교과목 교과영역(*) 인증구분(*) 관련 항목 (ABEEK Classification) (ABEEK Requirement) 필수 선수과목 권장 선수과목 딥러닝, 머신러닝, 컴퓨터비전, 자연언어처...\n2주차 내용 요약: 주차별 강의개요 주 (Week) ( ) ( ) ( ) Course Introduction, Deep 교수자와 과목에 대해 자세히 소개하고\n3주차 내용 요약: 설계교육계획서(공학인증) 교과목명 담당교수 학점(설계학점) 설계주제 문제정의 개념설계 설계 구성요소 설계구현 평가/피드백 경제성/생산성 사회윤리 현실적 제한조건 심미성/사용성 안전/환경 Open-ended problem 설계 Teamwork 운영요소 Communication skills\n4주차 내용 요약: Lecture Note 6 Representation 에 대해 이해합니다. 기 , 미적용 Modality Alignment, 이미지와 텍스트 정보를 정렬하는 방법에 강의, 토론, 시험, 실험,실습,실\n5주차 내용 요약: Lecture Note 7 Vision-Language Models 대해 이해합니다. 기 , 미적용 MLLMs의 구조와 학습 방식에 대해 이해 강의, 토론, 시험, 실험,실습,실\n6주차 내용 요약: MLLM Structure, MLLM Training Lecture Note 8 합니다. 기 , 미적용 MLLM Inference, MLLM MLLMs의 추론과 평가 방식에 대해 이해 강의, 토론, 실험,실습,실기 ,\n7주차 내용 요약: Lecture Note 9 Evaluation 합니다. 문제정의 PPP1: Project Proposal\n8주차 내용 요약: 팀 프로젝트를 제안합니다. 발표, 토론 , 아이디어 도출 Presentation 강의, 토론, 시험, 실험,실습,실\n9주차 내용 요약: Open-source MLLM 최신 Open-sourse MLLMs를 살펴봅니다. Lecture Note 10 기 , 미적용 MLLM in Document 문서 이해 분야에 대해 이해하고 MLLMs 강의, 토론, 실험,실습,실기 ,\n10주차 내용 요약: Lecture Note 11 Understanding 의 활용 방식을 살펴봅니다. 미적용 PPP2: Project Progress 발표, 토론 , 해결방안적용및\n11주차 내용 요약: 팀 프로젝트 진행 상황을 발표합니다. Presentation 확인 MLLMs의 추론 능력 향상을 위한 방법들 강의, 토론, 실험,실습,실기 ,\n12주차 내용 요약: Enhancing Reasoning for MLLM Lecture Note 12 을 살펴봅니다. 미적용 MLLMs 관련 연구를 진행중인 외부 연사\n13주차 내용 요약: Invited Talk 강의, 현장학습 , 미적용 를 초청합니다. PPP3: Project Performance 발표, 토론 , 해결방안적용및\n14주차 내용 요약: 팀 프로젝트의 최종 결과를 발표합니다. Presentation 확인 PPP3: Project Performance 발표, 토론 , 해결방안적용및\n15주차 내용 요약: 팀 프로젝트의 최종 결과를 발표합니다. Presentation 확인 [ 장애학생을 위한 강의 지원 안내 내용 ] ※ 숭실대학교 학칙 제65조의 2에 의거하여, 장애학생은 학기 시작 전후에 교과목 담당교수와 의 면담을 통해 출석, 강의, 과제 및 평가에 관한 지원 사항을 요청할 수 있으며, 요청한 사 항은 담당교수 또는 장애학생지원센터를 통해 지원받을 수 있습니다. 강의, 과제 및 평가 시, 가능한 장애유형별 지원의 예는 아래와 같습니다. 단, 실제 지원 내용은 강의 특성에 따 라 달라질 수 있습니다. [ 강의 ] 시각장애: 강의자료 제공, 대필 도우미 허용, 강의녹취 허용 지체장애: 강의자료 제공, 대필 및 수업보조 도우미 허용, 지정좌석 배정, 강의녹취 허용 청각장애: 강의자료 제공, 대필/수화통역 도우미..."
  },
  {
    "meta": {
      "강좌명": "컴퓨터비전 한영준 동영상강의 계획서 없음",
      "담당교수": "컴퓨터비전 한영준 동영상강의 계획서 없음",
      "년도": "2025학년도",
      "학기": "2학기",
      "과목코드": "2025",
      "수강대상학과": "3학년 AI융합학부,AI로봇융합,AI모 이수구분 전선-AI융합",
      "필수 선수과목": "권장 선수과목 선형대수, 인공지능, 확률및통계, 프로그래밍및실습, 고급프로그래밍및실습, 자료구조",
      "권장 선수과목": "선형대수, 인공지능, 확률및통계, 프로그래밍및실습, 고급프로그래밍및실습, 자료구조"
    },
    "chunk": "이 강의는 '컴퓨터비전 한영준 동영상강의 계획서 없음' 과목입니다. 담당 교수는 컴퓨터비전 한영준 동영상강의 계획서 없음입니다.개설 정보: 2025학년도 2학기\n1. 과목개요 강좌명 담당교수 컴퓨터비전 한영준 동영상강의 계획서 없음 (Course Title) (Instructor) 년도 학기 과목코드 2025학년도 2학기 2150054901 (Year) (Semester) (Course No.) 분반 01 수강대상학과 3학년 AI융합학부,AI로봇융합,AI모 이수구분 전선-AI융합 (Class) (Open to) 빌리티융합,인공지능반도체융합 (Course Classification) 학점/주당시간 3.0 / 03 / 3 성적스케일 점수 100기준 입력 성적평가방식 상대평가 교과목유형 이론 강의언어 상담 신청 방법 이메일 교수실 연락처 형남공학관1409호 02-820-0699 이메일 (e-mail) young@ssu.ac.kr (Office) (Telephone) 이론, 토론식수업, 문제 강좌형식 수업유형 동영상 제작년도 기반학습(PBL) 공학인증 교과목 교과영역(*) 인증구분(*) 관련 항목 (ABEEK Classification) (ABEEK Requirement) 필수 선수과목 권장 선수과목 선형대수, 인공지능, 확률및통계, 프로그래밍및실습, 고급프로그래밍및실습, 자료구조 객체 인식 등 컴퓨터 비전의 기본 개념과 방법들을 OpenCV를 이용하여 배운 (Course 다. Description) 교육목표 전공특화역량 AI/빅데이터 역량 OpenCV와 파이썬 언어를 통해 다양한 영상처리 방법들을 이해하고 프로그래밍할 수 있다. 응용 소프트웨어 역량 AI/빅데이터 역량 Pytorch 기반 컴퓨터 비전 분야의 최신 딥러닝 기술들을 학습하고 구현할 수 있다 응용 소프트웨어 역량 AI/빅데이터 역량 팀 협업을 통해 딥러닝 관련 팀 프로젝트를 수행한다 자율주행 개발 역량 응용 소프트웨어 역량 평가항목 각 항목별 만점(최대 100점) 반영비율(합계 100%) 중간고사 100 30 기말고사 100 30 과제 100 30 출석 10 10 주요교재 */정성환&배종욱/생능출판사/2020/1/ d Texts) 학습준비사항 수강학생 유의 및 참고사항 2. 주차별 강의개요 주 핵심어 세부내용 ption) (Texts) - 강의계획서 및 강의소개 별도자료 0\n1주차 내용 요약: 과목개요 강좌명 담당교수 컴퓨터비전 한영준 동영상강의 계획서 없음 (Course Title) (Instructor) 년도 학기 과목코드 2025학년도 2학기 2150054901 (Year) (Semester) (Course No.) 분반 01 수강대상학과 3학년 AI융합학부,AI로봇융합,AI모 이수구분 전선-AI융합 (Class) (Open to) 빌리티융합,인공지능반도체융합 (Course Classification) 학점/주당시간 3.0 / 03 / 3 성적스케일 점수 100기준 입력 성적평가방식 상대평가 교과목유형 이론 강의언어 상담 신청 방법 이메일 교수실 연락처 형남공학관1409호 02-820-0699 이메일 (e-mail) young@ssu.ac.kr (Office) (Telephone) 이론, 토...\n2주차 내용 요약: 영상처리를 위한 행렬 연산 강의, 실험,실습,실기 - 보고서 2: 주교재 3장 - Pytorch Tensor 구조 이해 및 4장 요약 - Pytorch 프레임을 통한 딥러닝 알고리즘 개발 과정 실습 - 영상 화소의 표현\n3주차 내용 요약: 설계교육계획서(공학인증) 교과목명 담당교수 학점(설계학점) 설계주제 문제정의 개념설계 설계 구성요소 설계구현 평가/피드백 경제성/생산성 사회윤리 현실적 제한조건 심미성/사용성 안전/환경 Open-ended problem 설계 Teamwork 운영요소 Communication skills\n4주차 내용 요약: 영역 처리 기법 - 에지 검출 강의, 실험,실습,실기 7장 - CNN 딥러닝 알고리즘 설계 및 구현 7장 - 필터링 기술 -보고서 3: 평활화 함\n5주차 내용 요약: 영역 처리 기법 - 모폴로지 강의, 실험,실습,실기 수 구현을 통한 영상처 - Auto Encoder를 이용한 영상 노이즈 제거 리 - 카메라 및 영상 표현\n6주차 내용 요약: 영상 기하학 강의, 실험,실습,실기 8장 - 핀홀 카메라 모델 8장 - 보간 - 보고서 4: 동차 변환 - 회전\n7주차 내용 요약: 영상 기하처리 강의, 실험,실습,실기 을 통한 영상 보간, 회 - 동차변환 전, 원근투시을 통한 - 원근 투시 영상처리 중간고사 이론 및 실기 중간고사\n8주차 내용 요약: 중간고사 - 이론 시험 시험 를 실시 - 실기 시험 - FastCNN 딥러닝 알고리즘 학습 - SSD 딥러닝 알고리즘 학습 별도 강의자료\n9주차 내용 요약: 물체검출 강의, 실험,실습,실기 - YOLO 딥러닝 알고리즘 학습 - YOLO V7 딥러닝 알고리즘 구현 및 추론 - 허프변환(Hough Transformation) 9장 - 코너검출\n10주차 내용 요약: 영상 분할 및 특징처리 강의, 실험,실습,실기 - 프로젝트 계획서 제 - 시멘틱 분할(PSPNet) 딥러닝 알고리즘 구 출 현 및 실습 - GAN 메카니즘 이해 - DC GAN 학습 및 이미지 생성\n11주차 내용 요약: GAN을 활용한 이미지 생성 강의, 실험,실습,실기 9장 - Self-Attention GAN의 학습 및 이미지 생 성 -공간 주파수의 이해 10장\n12주차 내용 요약: 주파수 공간에서 영상처리 - 이산 푸리에 변환 강의, 실험,실습,실기 -보고서 5: 허프 변환을 - FFT 변환 통한 차선 검출 - KITII 영상 데이터셋을 활용한 교통 객체\n13주차 내용 요약: 프로젝트 발표 1 검출 (차량, 이륜차, 보행자) 딥러닝 알고리 발표, 실험,실습,실기 - 프로젝트 발표 즘 구현 - KITII 영상 데이터셋을 활용한 교통 객체\n14주차 내용 요약: 프로젝트 발표 2 검출 (차량, 이륜차, 보행자) 딥러닝 알고리 발표, 실험,실습,실기 - 프로젝트 발표 즘 구현 기말고사 이론 및 실기 중간고사\n15주차 내용 요약: 기말고사 - 이론 시험 시험 실시 - 실기 시험 [ 장애학생을 위한 강의 지원 안내 내용 ] ※ 숭실대학교 학칙 제65조의 2에 의거하여, 장애학생은 학기 시작 전후에 교과목 담당교수와 의 면담을 통해 출석, 강의, 과제 및 평가에 관한 지원 사항을 요청할 수 있으며, 요청한 사 항은 담당교수 또는 장애학생지원센터를 통해 지원받을 수 있습니다. 강의, 과제 및 평가 시, 가능한 장애유형별 지원의 예는 아래와 같습니다. 단, 실제 지원 내용은 강의 특성에 따 라 달라질 수 있습니다. [ 강의 ] 시각장애: 강의자료 제공, 대필 도우미 허용, 강의녹취 허용 지체장애: 강의자료 제공, 대필 및 수업보조 도우미 허용, 지정좌석 배정, 강의녹취 허용 청각장애: 강의자료 제공, 대필/수화통역 도우미 허용 지적장애/자폐..."
  },
  {
    "meta": {
      "강좌명": "오픈소스기초설계 김성흠 동영상강의 계획서 없음",
      "담당교수": "오픈소스기초설계 김성흠 동영상강의 계획서 없음",
      "년도": "2025학년도",
      "학기": "2학기",
      "과목코드": "2025",
      "수강대상학과": "이수구분",
      "필수 선수과목": "권장 선수과목 컴퓨팅적사고, 프로그래밍및실습1(Python)",
      "권장 선수과목": "컴퓨팅적사고, 프로그래밍및실습1(Python)"
    },
    "chunk": "이 강의는 '오픈소스기초설계 김성흠 동영상강의 계획서 없음' 과목입니다. 담당 교수는 오픈소스기초설계 김성흠 동영상강의 계획서 없음입니다.개설 정보: 2025학년도 2학기\n1. 과목개요 강좌명 담당교수 오픈소스기초설계 김성흠 동영상강의 계획서 없음 (Course Title) (Instructor) 년도 학기 과목코드 2025학년도 2학기 2150054501 (Year) (Semester) (Course No.) 분반 수강대상학과 이수구분\n1주차 내용 요약: 1학년 AI융합학부 전기-AI융합 (Class) (Open to) (Course Classification) 학점/주당시간 3.0 / 03 / 3 성적스케일 점수 100기준 입력 성적평가방식 절대평가 교과목유형 이론 강의언어 상담 신청 방법 스마트캠퍼스LMS 교수실 연락처 연구관202호 02-820-0955 이메일 (e-mail) seongheum@ssu.ac.kr (Office) (Telephone) 이론, 토론식수업, 문제 강좌형식 수업유형 동영상 제작년도 기반학습(PBL) 공학인증 교과목 교과영역(*) 인증구분(*) 관련 항목 (ABEEK Classification) (ABEEK Requirement) 필수 선수과목 권장 선수과목 컴퓨팅적사고, 프로그래밍및실습1(Python) 교과목 개요 오픈 소스 S...\n2주차 내용 요약: 주차별 강의개요 주 (Week) ( ) ( ) ( ) [실습] 팀 빌딩 시작 (주교재) 우분트 리눅 - 강의 내용 소개 스 EXPRESS 강의, 실험,실습,실기 , 문제정\n3주차 내용 요약: 설계교육계획서(공학인증) 교과목명 담당교수 학점(설계학점) 설계주제 문제정의 개념설계 설계 구성요소 설계구현 평가/피드백 경제성/생산성 사회윤리 현실적 제한조건 심미성/사용성 안전/환경 Open-ended problem 설계 Teamwork 운영요소 Communication skills\n4주차 내용 요약: 오픈소스 개발도구 소개 (주교재) 5장, 6장, 8장, Ex. 2) 버전관리 실습 의 9장 (참고교재) 6장 강의자료 PPT - 소스 버전 관리 및 협업 강의, 실험,실습,실기 , 아이디\n5주차 내용 요약: 오픈소스 버전 관리 [실습] 개별 프로젝트 - HuggingFace 소개 어 도출 제안서 1차 마감 강의자료 PPT - 파이썬 리뷰 실험,실습,실기 , 아이디어 도\n6주차 내용 요약: 프로그래밍 언어 개요 (휴강으로 강의 대체 - 다양한 프로그래밍 언어 출 예정) [실습] Git 실습 & 개별 프로젝트 제안서 제출 - 셸 스크립트 기초 문법 이해 강의, 실험,실습,실기 , 아이디\n7주차 내용 요약: 셸 스크립트 기초 마감 Ex. 3) 셸 스크립팅 활용 어 도출 (주교재) 13장 (참고교재) 7장, 8장 강의자료 PPT Linux 환경에서의 프로그래밍 기 - C/C++ 기초 리뷰 강의, 실험,실습,실기 , 아이디 [실습] 팀 변경 완료 08 초 - C 언어의 이해 및 활용 어 도출 (주교재) 10장 (참고교재) 9장~18장 강의자료 PPT Linux 환경에서의 프로그래밍 활 - 오픈소스 개발 언어/도구 정리 강의, 실험,실습,실기 , 아이디 [실습] Linux 환경에서 09 용 - 시스템 프로그래밍 기초 어 도출 의 프로그래밍 (주교재) 11장 강의자료 PPT - 도커와 컨테이너 이해 강의, 실험,실습,실기 , 아이디 [실습] Shell script 과제\n10주차 내용 요약: 오픈소스 배포관리 - 오픈소스 SW배포와 운영 어 도출 제출 마감 Ex. 4) Docker 활용 (주교재) 12장 강의자료 PPT - 오픈소스 웹/앱 프레임워크 소개 강의, 실험,실습,실기 , 아이디\n11주차 내용 요약: 웹/앱 개발 기초 (주교재) 14장 - HTML/CSS/JS 기초 이해 어 도출 (참고교재) 19장 강의자료 PPT - 모바일 플랫폼에서의 오픈소스 사례 강의, 실험,실습,실기 , 아이디 (주교재) 15장\n12주차 내용 요약: 웹/앱 개발 활용 - Java/Kotlin 등 앱 프로그래밍 개요 어 도출 [실습] 팀별 프로젝트 보고서 1차 마감 강의자료 PPT (주교재) 16장 - Linux 환경에서의 프로그래밍 리뷰 [실습] Docker 과제 제 발표, 토론, 시험, 실험,실습,실\n13주차 내용 요약: 오픈소스 하드웨어 개요 - 아두이노, 라즈베리, 젯슨나노/자비에 등 출 마감 기 , 해결방안적용및 확인 - 프로젝트 수행 및 평가 주차별로 4~6개 팀 발 표수업 (대면 또는 Zoom 면담 1회 권장) 주차별로 4~6개 팀 발 - 오픈소스SW 설계/개발 및 배포 발표, 토론, 시험 , 해결방안적\n14주차 내용 요약: 프로젝트 수행 및 평가 표수업 (대면 또는 - 발표 평가 용및 확인 Zoom 면담 1회 권장) 주차별로 4~6개 팀 발 표수업 (대면 또는 - 오픈소스SW 설계/개발 및 배포 발표, 토론, 시험 , 해결방안적 Zoom 면담 1회 권장)\n15주차 내용 요약: 프로젝트 수행 및 평가 - 발표 평가 및 최종보고서 제출 용및 확인 *팀별 프로젝트 보고 서 제출 후 Peer Review 진행 필수* [ 장애학생을 위한 강의 지원 안내 내용 ] ※ 숭실대학교 학칙 제65조의 2에 의거하여, 장애학생은 학기 시작 전후에 교과목 담당교수와 의 면담을 통해 출석, 강의, 과제 및 평가에 관한 지원 사항을 요청할 수 있으며, 요청한 사 항은 담당교수 또는 장애학생지원센터를 통해 지원받을 수 있습니다. 강의, 과제 및 평가 시, 가능한 장애유형별 지원의 예는 아래와 같습니다. 단, 실제 지원 내용은 강의 특성에 따 라 달라질 수 있습니다. [ 강의 ] 시각장애: 강의자료 제공, 대필 도우미 허용, 강의녹취 허용 지체장애: 강의자료 제공, 대필 및 수업보조 도우미 허용, 지정좌석..."
  },
  {
    "meta": {
      "강좌명": "이산수학 정규식 동영상강의 계획서 없음",
      "담당교수": "이산수학 정규식 동영상강의 계획서 없음",
      "년도": "2025학년도",
      "학기": "2학기",
      "과목코드": "2025",
      "수강대상학과": "이수구분",
      "필수 선수과목": "프로그래밍 및 실습1 (파이썬)",
      "권장 선수과목": "교과목 개요"
    },
    "chunk": "이 강의는 '이산수학 정규식 동영상강의 계획서 없음' 과목입니다. 담당 교수는 이산수학 정규식 동영상강의 계획서 없음입니다.개설 정보: 2025학년도 2학기\n1. 과목개요 강좌명 담당교수 이산수학 정규식 동영상강의 계획서 없음 (Course Title) (Instructor) 년도 학기 과목코드 2025학년도 2학기 2150686601 (Year) (Semester) (Course No.) 분반 수강대상학과 이수구분\n1주차 내용 요약: 1학년 AI융합학부 전필-AI융합 (Class) (Open to) (Course Classification) 학점/주당시간 3.0 (0 ) / 3 성적스케일 점수 100기준 입력 성적평가방식 상대평가 교과목유형 이론 강의언어 상담 신청 방법 이메일 교수실 연락처 01087200637 이메일 (e-mail) kchung@ssu.ac.kr (Office) (Telephone) 강좌형식 이론, 토론식수업 수업유형 동영상 제작년도 공학인증 교과목 교과영역(*) 인증구분(*) 관련 항목 (ABEEK Classification) (ABEEK Requirement) 필수 선수과목 프로그래밍 및 실습1 (파이썬) 권장 선수과목 교과목 개요 컴퓨터에 요구되는 이산 수학으로서 형식논리, 알고리즘 증명, 재귀, 집합, 순열과...\n2주차 내용 요약: 주차별 강의개요 주 (Week) ( ) ( ) ( ) (1강) 부교재1-1장 (1강) 강의 소개 및 이산수학 개요\n3주차 내용 요약: 설계교육계획서(공학인증) 교과목명 담당교수 학점(설계학점) 설계주제 문제정의 개념설계 설계 구성요소 설계구현 평가/피드백 경제성/생산성 사회윤리 현실적 제한조건 심미성/사용성 안전/환경 Open-ended problem 설계 Teamwork 운영요소 Communication skills\n4주차 내용 요약: 알고리즘 예제-sorting 강의, 토론 (7&8강) 참고자료 (9강) 참고자료 알고리즘 복잡도분석, (9강) 알고리즘 복잡도 분석\n5주차 내용 요약: 강의, 토론 (10강) 부교재1-12장, 관계 (10강) 관계 부교재2-9장 (11강) 그래프\n6주차 내용 요약: 그래프, 트리 강의, 토론 (11&12강) 참고자료 (12강) 트리 알고리즘 설계방법 소개 (13강) 알고리즘 설계방법 소개 (13강) 참고자료\n7주차 내용 요약: 강의, 토론 알고리즘 설계방법 1 (14강) 알고리즘 설계방법 1(분할정복) (14강) 부교재3-3장 (15강) 알고리즘 설계방법 2(동적프로그 (15강) 부교재3-5장\n8주차 내용 요약: 알고리즘 설계방법 2 래밍) 강의, 토론, 시험 (16강) 중간고사 (17강)알고리즘 설계방법 2(동적프로그래 알고리즘 설계방법 3 (17강) 부교재3-5장\n9주차 내용 요약: 밍) 강의, 토론 중간고사 (18강) 부교재3-4장 (18강) 알고리즘 설계방법3(탐욕내기) 알고리즘 설계방법 3 (19강) 알고리즘 설계방법 3(탐욕내기) (19강) 부교재3-4장\n10주차 내용 요약: 강의, 토론 알고리즘 설계방법 4 (20강) 알고리즘 설계방법 4(되돌아가기) (20강) 부교재3-6장 알고리즘 설계방법 4 (21강) 알고리즘 설계방법 4(되돌아가기) (21강) 부교재3-6장\n11주차 내용 요약: 강의, 토론 알고리즘 설계방법 5 (22강) 알고리즘 설계방법 5(근사방법) (22강) 부교재3-7장 (23강) 부교재1-11장 (23강) 부울대수\n12주차 내용 요약: 부울대수, Counting 강의, 토론 (24강) 부교재1-9장, 부 (24강) Counting 교재2-6장 (25&26강) 부교재1-9\n13주차 내용 요약: Counting (25&26강) Counting 강의, 토론 장, 부교재2- 7,8장 (27&28강) 부교재2-4\n14주차 내용 요약: 정수론 (27&28강) 정수론 강의, 토론 장 (29강) 과목정리\n15주차 내용 요약: 과목정리, 기말고사 강의, 토론, 시험 (30강) 기말 고사 [ 장애학생을 위한 강의 지원 안내 내용 ] ※ 숭실대학교 학칙 제65조의 2에 의거하여, 장애학생은 학기 시작 전후에 교과목 담당교수와 의 면담을 통해 출석, 강의, 과제 및 평가에 관한 지원 사항을 요청할 수 있으며, 요청한 사 항은 담당교수 또는 장애학생지원센터를 통해 지원받을 수 있습니다. 강의, 과제 및 평가 시, 가능한 장애유형별 지원의 예는 아래와 같습니다. 단, 실제 지원 내용은 강의 특성에 따 라 달라질 수 있습니다. [ 강의 ] 시각장애: 강의자료 제공, 대필 도우미 허용, 강의녹취 허용 지체장애: 강의자료 제공, 대필 및 수업보조 도우미 허용, 지정좌석 배정, 강의녹취 허용 청각장애: 강의자료 제공, 대필/수화통역 도우미 허용..."
  },
  {
    "meta": {
      "강좌명": "인공지능입문 박건우 동영상강의 계획서 없음",
      "담당교수": "인공지능입문 박건우 동영상강의 계획서 없음",
      "년도": "2025학년도",
      "학기": "2학기",
      "과목코드": "2025",
      "수강대상학과": "이수구분",
      "필수 선수과목": "프로그래밍및실습1(파이썬)",
      "권장 선수과목": "교과목 개요 인공지능은 컴퓨터를 통해 인간 지능을 구현한 컴퓨터 알고리즘이나 컴퓨터시스템이다. 본 과목에서는 인공지능의 핵"
    },
    "chunk": "이 강의는 '인공지능입문 박건우 동영상강의 계획서 없음' 과목입니다. 담당 교수는 인공지능입문 박건우 동영상강의 계획서 없음입니다.개설 정보: 2025학년도 2학기\n1. 과목개요 강좌명 담당교수 인공지능입문 박건우 동영상강의 계획서 없음 (Course Title) (Instructor) 년도 학기 과목코드 2025학년도 2학기 2150031001 (Year) (Semester) (Course No.) 분반 수강대상학과 이수구분\n1주차 내용 요약: 1학년 AI융합학부,AI로봇융합,AI모빌리티융 전선-AI융합 (Class) (Open to) 합,스마트자동차융합,인공지능 (Course Classification) 학점/주당시간 3.0 / 03 / 3 성적스케일 점수 100기준 입력 성적평가방식 상대평가 교과목유형 이론 강의언어 상담 신청 방법 이메일 교수실 연락처\n2주차 내용 요약: 820-0951 이메일 (e-mail) kunwoo.park@ssu.ac.kr (Office) (Telephone) 이론, 문제기반학습 강좌형식 수업유형 동영상 제작년도 (PBL) 공학인증 교과목 교과영역(*) 인증구분(*) 관련 항목 (ABEEK Classification) (ABEEK Requirement) 필수 선수과목 프로그래밍및실습1(파이썬) 권장 선수과목 교과목 개요 인공지능은 컴퓨터를 통해 인간 지능을 구현한 컴퓨터 알고리즘이나 컴퓨터시스템이다. 본 과목에서는 인공지능의 핵 (Course 심 요소기술인 탐색, 지식의 표현 및 추론, 계획수립 등을 학습하고 응용분야인 전문가 시스템, 기계학습, 데이터 마이닝 ) 등을 포함한 인공지능 이론을 학습한다. 교육목표 전공특화역량 인공지능의 역사, 분류,...\n3주차 내용 요약: 설계교육계획서(공학인증) 교과목명 담당교수 학점(설계학점) 설계주제 문제정의 개념설계 설계 구성요소 설계구현 평가/피드백 경제성/생산성 사회윤리 현실적 제한조건 심미성/사용성 안전/환경 Open-ended problem 설계 Teamwork 운영요소 Communication skills\n4주차 내용 요약: 강의, 실험,실습,실기 (교재 2) 2-2장, 3-1장 귀 귀 모델을 구현한다. 선형 회귀 모델을 다룬다. 문제 해결형 실\n5주차 내용 요약: 선형 회귀, Lab 강의, 실험,실습,실기 (교재 2) 3-2장 습을 수행한다.\n6주차 내용 요약: 인공지능 윤리, 신뢰성 인공지능 윤리와 신뢰성에 관해 다룬다. 강의 (교재 1) 3장, 4장 특성 공학 및 규제에 대해 다룬다. 전반부\n7주차 내용 요약: 특성 공학, 규제, 요약 강의, 실험,실습,실기 (교재 2) 3-3장 내용을 요약한다. 중간 시험 일시\n8주차 내용 요약: 중간 시험 중간 시험을 본다. (범위: 1~7주차) 시험 10/20 19:00-20:30 분류, 로지스틱 회귀, 군집화, k- 분류, 군집 문제와 로지스틱 회귀, k-평균 (교재 2) 4-1장, 6-1장,\n9주차 내용 요약: 강의, 실험,실습,실기 평균 알고리즘에 대해 다룬다. 6-2장 인공지능 구현 기술, 빅데이터, 인공지능 구현 기술, 빅데이터, 딥러닝에\n10주차 내용 요약: 강의 (교재 1) 6장, 7장, 9장 딥러닝 대해 다룬다. 주성분 분석에 대해 배운다. 문제 해결형\n11주차 내용 요약: 주성분 분석, Lab 강의, 실험,실습,실기 (교재 2) 6-3장 실습을 수행한다.\n12주차 내용 요약: 생성형 AI, 언어 생성, LLM 언어 생성을 위한 AI 기술에 대해 다룬다. 강의, 실험,실습,실기 별도자료 생성형 AI, 이미지 동영상 생성, 이미지 및 동영상 생성을 위한 AI 기술에\n13주차 내용 요약: 강의, 실험,실습,실기 별도자료 확산모델 대해 다룬다. 문제 해결형 실습을 수행한다. 후반부 내\n14주차 내용 요약: Lab, 요약 강의, 실험,실습,실기 별도자료 용을 요약한다. 기말 시험 일시\n15주차 내용 요약: 기말 시험 기말 시험을 본다. (범위: 9~14 주차) 시험 12/8 19:00-20:30 [ 장애학생을 위한 강의 지원 안내 내용 ] ※ 숭실대학교 학칙 제65조의 2에 의거하여, 장애학생은 학기 시작 전후에 교과목 담당교수와 의 면담을 통해 출석, 강의, 과제 및 평가에 관한 지원 사항을 요청할 수 있으며, 요청한 사 항은 담당교수 또는 장애학생지원센터를 통해 지원받을 수 있습니다. 강의, 과제 및 평가 시, 가능한 장애유형별 지원의 예는 아래와 같습니다. 단, 실제 지원 내용은 강의 특성에 따 라 달라질 수 있습니다. [ 강의 ] 시각장애: 강의자료 제공, 대필 도우미 허용, 강의녹취 허용 지체장애: 강의자료 제공, 대필 및 수업보조 도우미 허용, 지정좌석 배정, 강의녹취 허용 청각장애: 강의자료 제공..."
  }
]